                                                                                               [32m[I 2025-08-04 14:56:37,321][0m Trial 50 finished with value: -999.0 and parameters: {'nn_model_type': 'deepfm', 'deepfm_embedding_dim': 38, 'deepfm_num_layers': 3, 'deepfm_base_dim': 320, 'deepfm_dropout': 0.018987152919206496, 'deepfm_lr': 0.00042049319667352813}. Best is trial 22 with value: 0.9749771944955573.[0m
Best trial: 22. Best value: 0.974977:  50%|█████████▌         | 50/100 [09:34<09:07, 10.95s/it]Best trial: 22. Best value: 0.974977:  50%|█████████▌         | 50/100 [09:34<09:07, 10.95s/it]Best trial: 22. Best value: 0.974977:  51%|█████████▋         | 51/100 [09:34<08:05,  9.91s/it]Variance threshold: 40004 → 40004 features
🔥 AMD ROCm GPU detected: AMD Radeon RX 7700 XT
🚀 Using GPU: cuda:0 - AMD Radeon RX 7700 XT (12.0GB ROCm)
                                                                                               [32m[I 2025-08-04 14:56:45,973][0m Trial 51 finished with value: 0.9675601535585455 and parameters: {'nn_model_type': 'resnet_custom', 'resnet_hidden_dim': 64, 'resnet_num_blocks': 3, 'resnet_dropout': 0.027378628237596292, 'resnet_lr': 0.0023744044949624062}. Best is trial 22 with value: 0.9749771944955573.[0m
Best trial: 22. Best value: 0.974977:  51%|█████████▋         | 51/100 [09:43<08:05,  9.91s/it]Best trial: 22. Best value: 0.974977:  51%|█████████▋         | 51/100 [09:43<08:05,  9.91s/it]Best trial: 22. Best value: 0.974977:  52%|█████████▉         | 52/100 [09:43<07:37,  9.53s/it]Variance threshold: 40004 → 40004 features
🔥 AMD ROCm GPU detected: AMD Radeon RX 7700 XT
🚀 Using GPU: cuda:0 - AMD Radeon RX 7700 XT (12.0GB ROCm)
                                                                                               [32m[I 2025-08-04 14:56:54,606][0m Trial 52 finished with value: 0.9710049433160325 and parameters: {'nn_model_type': 'resnet_custom', 'resnet_hidden_dim': 64, 'resnet_num_blocks': 3, 'resnet_dropout': 0.00019266315574742042, 'resnet_lr': 0.00280322284835299}. Best is trial 22 with value: 0.9749771944955573.[0m
Best trial: 22. Best value: 0.974977:  52%|█████████▉         | 52/100 [09:51<07:37,  9.53s/it]Best trial: 22. Best value: 0.974977:  52%|█████████▉         | 52/100 [09:51<07:37,  9.53s/it]Best trial: 22. Best value: 0.974977:  53%|██████████         | 53/100 [09:51<07:15,  9.26s/it]Variance threshold: 40004 → 40004 features
🔥 AMD ROCm GPU detected: AMD Radeon RX 7700 XT
🚀 Using GPU: cuda:0 - AMD Radeon RX 7700 XT (12.0GB ROCm)
                                                                                               [32m[I 2025-08-04 14:57:03,041][0m Trial 53 finished with value: 0.9671179168394649 and parameters: {'nn_model_type': 'resnet_custom', 'resnet_hidden_dim': 64, 'resnet_num_blocks': 2, 'resnet_dropout': 0.0035775629535762187, 'resnet_lr': 0.003959178208396258}. Best is trial 22 with value: 0.9749771944955573.[0m
Best trial: 22. Best value: 0.974977:  53%|██████████         | 53/100 [10:00<07:15,  9.26s/it]Best trial: 22. Best value: 0.974977:  53%|██████████         | 53/100 [10:00<07:15,  9.26s/it]Best trial: 22. Best value: 0.974977:  54%|██████████▎        | 54/100 [10:00<06:54,  9.01s/it]Variance threshold: 40004 → 40004 features
🔥 AMD ROCm GPU detected: AMD Radeon RX 7700 XT
🚀 Using GPU: cuda:0 - AMD Radeon RX 7700 XT (12.0GB ROCm)
                                                                                               [32m[I 2025-08-04 14:57:12,544][0m Trial 54 finished with value: 0.9698646274060548 and parameters: {'nn_model_type': 'resnet_custom', 'resnet_hidden_dim': 128, 'resnet_num_blocks': 3, 'resnet_dropout': 0.00029602504664760776, 'resnet_lr': 0.0010067802125037291}. Best is trial 22 with value: 0.9749771944955573.[0m
Best trial: 22. Best value: 0.974977:  54%|██████████▎        | 54/100 [10:09<06:54,  9.01s/it]Best trial: 22. Best value: 0.974977:  54%|██████████▎        | 54/100 [10:09<06:54,  9.01s/it]Best trial: 22. Best value: 0.974977:  55%|██████████▍        | 55/100 [10:09<06:52,  9.16s/it]Variance threshold: 40004 → 40004 features
🔥 AMD ROCm GPU detected: AMD Radeon RX 7700 XT
🚀 Using GPU: cuda:0 - AMD Radeon RX 7700 XT (12.0GB ROCm)
                                                                                               [32m[I 2025-08-04 14:57:22,210][0m Trial 55 finished with value: 0.9669723311198047 and parameters: {'nn_model_type': 'resnet_custom', 'resnet_hidden_dim': 128, 'resnet_num_blocks': 4, 'resnet_dropout': 0.02583179647252659, 'resnet_lr': 0.0009996700336723755}. Best is trial 22 with value: 0.9749771944955573.[0m
Best trial: 22. Best value: 0.974977:  55%|██████████▍        | 55/100 [10:19<06:52,  9.16s/it]Best trial: 22. Best value: 0.974977:  55%|██████████▍        | 55/100 [10:19<06:52,  9.16s/it]Best trial: 22. Best value: 0.974977:  56%|██████████▋        | 56/100 [10:19<06:49,  9.31s/it]Variance threshold: 40004 → 40004 features
🔥 AMD ROCm GPU detected: AMD Radeon RX 7700 XT
🚀 Using GPU: cuda:0 - AMD Radeon RX 7700 XT (12.0GB ROCm)
                                                                                               [32m[I 2025-08-04 14:57:35,677][0m Trial 56 finished with value: -999.0 and parameters: {'nn_model_type': 'dcn', 'dcn_cross_layers': 4, 'dcn_deep_layers': 5, 'dcn_base_dim': 320, 'dcn_dropout': 0.12940622573320826, 'dcn_lr': 1.170046399602384e-05}. Best is trial 22 with value: 0.9749771944955573.[0m
Best trial: 22. Best value: 0.974977:  56%|██████████▋        | 56/100 [10:32<06:49,  9.31s/it]Best trial: 22. Best value: 0.974977:  56%|██████████▋        | 56/100 [10:32<06:49,  9.31s/it]Best trial: 22. Best value: 0.974977:  57%|██████████▊        | 57/100 [10:32<07:34, 10.56s/it]Variance threshold: 40004 → 40004 features
🔥 AMD ROCm GPU detected: AMD Radeon RX 7700 XT
🚀 Using GPU: cuda:0 - AMD Radeon RX 7700 XT (12.0GB ROCm)
                                                                                               [32m[I 2025-08-04 14:57:44,364][0m Trial 57 finished with value: 0.9389167793651345 and parameters: {'nn_model_type': 'resnet_custom', 'resnet_hidden_dim': 64, 'resnet_num_blocks': 3, 'resnet_dropout': 0.02289917287534031, 'resnet_lr': 0.0015318470322742861}. Best is trial 22 with value: 0.9749771944955573.[0m
Best trial: 22. Best value: 0.974977:  57%|██████████▊        | 57/100 [10:41<07:34, 10.56s/it]Best trial: 22. Best value: 0.974977:  57%|██████████▊        | 57/100 [10:41<07:34, 10.56s/it]Best trial: 22. Best value: 0.974977:  58%|███████████        | 58/100 [10:41<06:59, 10.00s/it]Variance threshold: 40004 → 40004 features
🔥 AMD ROCm GPU detected: AMD Radeon RX 7700 XT
🚀 Using GPU: cuda:0 - AMD Radeon RX 7700 XT (12.0GB ROCm)
                                                                                               [32m[I 2025-08-04 14:57:48,501][0m Trial 58 finished with value: -999.0 and parameters: {'nn_model_type': 'simple_mlp', 'mlp_hidden_dim': 256, 'mlp_num_layers': 4, 'mlp_dropout': 0.480069546719781, 'mlp_lr': 0.0003419989531983453}. Best is trial 22 with value: 0.9749771944955573.[0m
Best trial: 22. Best value: 0.974977:  58%|███████████        | 58/100 [10:45<06:59, 10.00s/it]Best trial: 22. Best value: 0.974977:  58%|███████████        | 58/100 [10:45<06:59, 10.00s/it]Best trial: 22. Best value: 0.974977:  59%|███████████▏       | 59/100 [10:45<05:37,  8.24s/it]Variance threshold: 40004 → 40004 features
🔥 AMD ROCm GPU detected: AMD Radeon RX 7700 XT
🚀 Using GPU: cuda:0 - AMD Radeon RX 7700 XT (12.0GB ROCm)
                                                                                               [32m[I 2025-08-04 14:57:57,634][0m Trial 59 finished with value: 0.9611563333348178 and parameters: {'nn_model_type': 'resnet_custom', 'resnet_hidden_dim': 64, 'resnet_num_blocks': 5, 'resnet_dropout': 0.04378382435666445, 'resnet_lr': 0.006946341460916499}. Best is trial 22 with value: 0.9749771944955573.[0m
Best trial: 22. Best value: 0.974977:  59%|███████████▏       | 59/100 [10:54<05:37,  8.24s/it]Best trial: 22. Best value: 0.974977:  59%|███████████▏       | 59/100 [10:54<05:37,  8.24s/it]Best trial: 22. Best value: 0.974977:  60%|███████████▍       | 60/100 [10:54<05:40,  8.51s/it]Variance threshold: 40004 → 40004 features
🔥 AMD ROCm GPU detected: AMD Radeon RX 7700 XT
🚀 Using GPU: cuda:0 - AMD Radeon RX 7700 XT (12.0GB ROCm)
                                                                                               [32m[I 2025-08-04 14:58:14,224][0m Trial 60 finished with value: 0.9461436065755633 and parameters: {'nn_model_type': 'resnet_custom', 'resnet_hidden_dim': 448, 'resnet_num_blocks': 3, 'resnet_dropout': 0.02209753975938123, 'resnet_lr': 0.0032163752395078715}. Best is trial 22 with value: 0.9749771944955573.[0m
Best trial: 22. Best value: 0.974977:  60%|███████████▍       | 60/100 [11:11<05:40,  8.51s/it]Best trial: 22. Best value: 0.974977:  60%|███████████▍       | 60/100 [11:11<05:40,  8.51s/it]Best trial: 22. Best value: 0.974977:  61%|███████████▌       | 61/100 [11:11<07:06, 10.93s/it]Variance threshold: 40004 → 40004 features
🔥 AMD ROCm GPU detected: AMD Radeon RX 7700 XT
🚀 Using GPU: cuda:0 - AMD Radeon RX 7700 XT (12.0GB ROCm)
                                                                                               [32m[I 2025-08-04 14:58:23,414][0m Trial 61 finished with value: 0.9710029863877506 and parameters: {'nn_model_type': 'resnet_custom', 'resnet_hidden_dim': 128, 'resnet_num_blocks': 2, 'resnet_dropout': 0.005453014683224913, 'resnet_lr': 0.0019406210354649778}. Best is trial 22 with value: 0.9749771944955573.[0m
Best trial: 22. Best value: 0.974977:  61%|███████████▌       | 61/100 [11:20<07:06, 10.93s/it]Best trial: 22. Best value: 0.974977:  61%|███████████▌       | 61/100 [11:20<07:06, 10.93s/it]Best trial: 22. Best value: 0.974977:  62%|███████████▊       | 62/100 [11:20<06:35, 10.41s/it]Variance threshold: 40004 → 40004 features
🔥 AMD ROCm GPU detected: AMD Radeon RX 7700 XT
🚀 Using GPU: cuda:0 - AMD Radeon RX 7700 XT (12.0GB ROCm)
                                                                                               [32m[I 2025-08-04 14:58:32,499][0m Trial 62 finished with value: 0.9561093000625668 and parameters: {'nn_model_type': 'resnet_custom', 'resnet_hidden_dim': 64, 'resnet_num_blocks': 3, 'resnet_dropout': 0.00016671580051536104, 'resnet_lr': 0.003464533169881508}. Best is trial 22 with value: 0.9749771944955573.[0m
Best trial: 22. Best value: 0.974977:  62%|███████████▊       | 62/100 [11:29<06:35, 10.41s/it]Best trial: 22. Best value: 0.974977:  62%|███████████▊       | 62/100 [11:29<06:35, 10.41s/it]Best trial: 22. Best value: 0.974977:  63%|███████████▉       | 63/100 [11:29<06:10, 10.01s/it]Variance threshold: 40004 → 40004 features
🔥 AMD ROCm GPU detected: AMD Radeon RX 7700 XT
🚀 Using GPU: cuda:0 - AMD Radeon RX 7700 XT (12.0GB ROCm)
                                                                                               [32m[I 2025-08-04 14:58:42,185][0m Trial 63 finished with value: 0.9720258132873525 and parameters: {'nn_model_type': 'resnet_custom', 'resnet_hidden_dim': 128, 'resnet_num_blocks': 3, 'resnet_dropout': 0.014984152646394305, 'resnet_lr': 0.0020142625137638424}. Best is trial 22 with value: 0.9749771944955573.[0m
Best trial: 22. Best value: 0.974977:  63%|███████████▉       | 63/100 [11:39<06:10, 10.01s/it]Best trial: 22. Best value: 0.974977:  63%|███████████▉       | 63/100 [11:39<06:10, 10.01s/it]Best trial: 22. Best value: 0.974977:  64%|████████████▏      | 64/100 [11:39<05:56,  9.91s/it]Variance threshold: 40004 → 40004 features
🔥 AMD ROCm GPU detected: AMD Radeon RX 7700 XT
🚀 Using GPU: cuda:0 - AMD Radeon RX 7700 XT (12.0GB ROCm)
                                                                                               [32m[I 2025-08-04 14:58:51,455][0m Trial 64 finished with value: 0.962078559086307 and parameters: {'nn_model_type': 'resnet_custom', 'resnet_hidden_dim': 128, 'resnet_num_blocks': 2, 'resnet_dropout': 0.02420038694493702, 'resnet_lr': 0.0017724160329561712}. Best is trial 22 with value: 0.9749771944955573.[0m
Best trial: 22. Best value: 0.974977:  64%|████████████▏      | 64/100 [11:48<05:56,  9.91s/it]Best trial: 22. Best value: 0.974977:  64%|████████████▏      | 64/100 [11:48<05:56,  9.91s/it]Best trial: 22. Best value: 0.974977:  65%|████████████▎      | 65/100 [11:48<05:40,  9.72s/it]Variance threshold: 40004 → 40004 features
🔥 AMD ROCm GPU detected: AMD Radeon RX 7700 XT
🚀 Using GPU: cuda:0 - AMD Radeon RX 7700 XT (12.0GB ROCm)
                                                                                               [32m[I 2025-08-04 14:59:26,258][0m Trial 65 finished with value: -3.622221324767557 and parameters: {'nn_model_type': 'deep_mlp', 'deep_mlp_num_layers': 6, 'deep_mlp_base_dim': 128, 'deep_mlp_dropout': 0.2534909194236273, 'deep_mlp_lr': 0.0001488450385876143}. Best is trial 22 with value: 0.9749771944955573.[0m
Best trial: 22. Best value: 0.974977:  65%|████████████▎      | 65/100 [12:23<05:40,  9.72s/it]Best trial: 22. Best value: 0.974977:  65%|████████████▎      | 65/100 [12:23<05:40,  9.72s/it]Best trial: 22. Best value: 0.974977:  66%|████████████▌      | 66/100 [12:23<09:46, 17.25s/it]Variance threshold: 40004 → 40004 features
🔥 AMD ROCm GPU detected: AMD Radeon RX 7700 XT
🚀 Using GPU: cuda:0 - AMD Radeon RX 7700 XT (12.0GB ROCm)
                                                                                               [32m[I 2025-08-04 14:59:38,126][0m Trial 66 finished with value: 0.6256030760932291 and parameters: {'nn_model_type': 'wide_deep', 'wd_deep_layers': 3, 'wd_deep_base_dim': 384, 'wd_wide_ratio': 0.2088989351220945, 'wd_lr': 0.00028622587753321323}. Best is trial 22 with value: 0.9749771944955573.[0m
Best trial: 22. Best value: 0.974977:  66%|████████████▌      | 66/100 [12:35<09:46, 17.25s/it]Best trial: 22. Best value: 0.974977:  66%|████████████▌      | 66/100 [12:35<09:46, 17.25s/it]Best trial: 22. Best value: 0.974977:  67%|████████████▋      | 67/100 [12:35<08:35, 15.63s/it]Variance threshold: 40004 → 40004 features
🔥 AMD ROCm GPU detected: AMD Radeon RX 7700 XT
🚀 Using GPU: cuda:0 - AMD Radeon RX 7700 XT (12.0GB ROCm)
                                                                                               [32m[I 2025-08-04 14:59:47,643][0m Trial 67 finished with value: 0.9552644606557311 and parameters: {'nn_model_type': 'resnet_custom', 'resnet_hidden_dim': 128, 'resnet_num_blocks': 3, 'resnet_dropout': 0.016478946860983744, 'resnet_lr': 0.0008550548303986007}. Best is trial 22 with value: 0.9749771944955573.[0m
Best trial: 22. Best value: 0.974977:  67%|████████████▋      | 67/100 [12:44<08:35, 15.63s/it]Best trial: 22. Best value: 0.974977:  67%|████████████▋      | 67/100 [12:44<08:35, 15.63s/it]Best trial: 22. Best value: 0.974977:  68%|████████████▉      | 68/100 [12:44<07:21, 13.80s/it]Variance threshold: 40004 → 40004 features
🔥 AMD ROCm GPU detected: AMD Radeon RX 7700 XT
🚀 Using GPU: cuda:0 - AMD Radeon RX 7700 XT (12.0GB ROCm)
                                                                                               [32m[I 2025-08-04 15:00:01,381][0m Trial 68 finished with value: 0.7117899867369042 and parameters: {'nn_model_type': 'resnet_custom', 'resnet_hidden_dim': 256, 'resnet_num_blocks': 8, 'resnet_dropout': 0.20302238121665578, 'resnet_lr': 0.0005499444829345348}. Best is trial 22 with value: 0.9749771944955573.[0m
Best trial: 22. Best value: 0.974977:  68%|████████████▉      | 68/100 [12:58<07:21, 13.80s/it]Best trial: 22. Best value: 0.974977:  68%|████████████▉      | 68/100 [12:58<07:21, 13.80s/it]Best trial: 22. Best value: 0.974977:  69%|█████████████      | 69/100 [12:58<07:07, 13.78s/it]Variance threshold: 40004 → 40004 features
🔥 AMD ROCm GPU detected: AMD Radeon RX 7700 XT
🚀 Using GPU: cuda:0 - AMD Radeon RX 7700 XT (12.0GB ROCm)
                                                                                               [32m[I 2025-08-04 15:00:10,079][0m Trial 69 finished with value: -999.0 and parameters: {'nn_model_type': 'deepfm', 'deepfm_embedding_dim': 41, 'deepfm_num_layers': 4, 'deepfm_base_dim': 512, 'deepfm_dropout': 0.1651704621140924, 'deepfm_lr': 0.0003144008234064351}. Best is trial 22 with value: 0.9749771944955573.[0m
Best trial: 22. Best value: 0.974977:  69%|█████████████      | 69/100 [13:07<07:07, 13.78s/it]Best trial: 22. Best value: 0.974977:  69%|█████████████      | 69/100 [13:07<07:07, 13.78s/it]Best trial: 22. Best value: 0.974977:  70%|█████████████▎     | 70/100 [13:07<06:07, 12.26s/it]Variance threshold: 40004 → 40004 features
🔥 AMD ROCm GPU detected: AMD Radeon RX 7700 XT
🚀 Using GPU: cuda:0 - AMD Radeon RX 7700 XT (12.0GB ROCm)
                                                                                               [32m[I 2025-08-04 15:00:23,637][0m Trial 70 finished with value: -999.0 and parameters: {'nn_model_type': 'dcn', 'dcn_cross_layers': 4, 'dcn_deep_layers': 3, 'dcn_base_dim': 320, 'dcn_dropout': 0.13202797814315548, 'dcn_lr': 0.00047616464720022365}. Best is trial 22 with value: 0.9749771944955573.[0m
Best trial: 22. Best value: 0.974977:  70%|█████████████▎     | 70/100 [13:20<06:07, 12.26s/it]Best trial: 22. Best value: 0.974977:  70%|█████████████▎     | 70/100 [13:20<06:07, 12.26s/it]Best trial: 22. Best value: 0.974977:  71%|█████████████▍     | 71/100 [13:20<06:06, 12.65s/it]Variance threshold: 40004 → 40004 features
🔥 AMD ROCm GPU detected: AMD Radeon RX 7700 XT
🚀 Using GPU: cuda:0 - AMD Radeon RX 7700 XT (12.0GB ROCm)
                                                                                               [32m[I 2025-08-04 15:00:32,469][0m Trial 71 finished with value: 0.7183252174143412 and parameters: {'nn_model_type': 'resnet_custom', 'resnet_hidden_dim': 64, 'resnet_num_blocks': 3, 'resnet_dropout': 0.014795248123767743, 'resnet_lr': 0.002093716808255211}. Best is trial 22 with value: 0.9749771944955573.[0m
Best trial: 22. Best value: 0.974977:  71%|█████████████▍     | 71/100 [13:29<06:06, 12.65s/it]Best trial: 22. Best value: 0.974977:  71%|█████████████▍     | 71/100 [13:29<06:06, 12.65s/it]Best trial: 22. Best value: 0.974977:  72%|█████████████▋     | 72/100 [13:29<05:22, 11.50s/it]Variance threshold: 40004 → 40004 features
🔥 AMD ROCm GPU detected: AMD Radeon RX 7700 XT
🚀 Using GPU: cuda:0 - AMD Radeon RX 7700 XT (12.0GB ROCm)
                                                                                               [32m[I 2025-08-04 15:00:41,258][0m Trial 72 finished with value: 0.9606320036831523 and parameters: {'nn_model_type': 'resnet_custom', 'resnet_hidden_dim': 64, 'resnet_num_blocks': 3, 'resnet_dropout': 0.013526653264181586, 'resnet_lr': 0.001556990387246056}. Best is trial 22 with value: 0.9749771944955573.[0m
Best trial: 22. Best value: 0.974977:  72%|█████████████▋     | 72/100 [13:38<05:22, 11.50s/it]Best trial: 22. Best value: 0.974977:  72%|█████████████▋     | 72/100 [13:38<05:22, 11.50s/it]Best trial: 22. Best value: 0.974977:  73%|█████████████▊     | 73/100 [13:38<04:48, 10.69s/it]Variance threshold: 40004 → 40004 features
🔥 AMD ROCm GPU detected: AMD Radeon RX 7700 XT
🚀 Using GPU: cuda:0 - AMD Radeon RX 7700 XT (12.0GB ROCm)
                                                                                               [32m[I 2025-08-04 15:00:50,932][0m Trial 73 finished with value: 0.9583087243071763 and parameters: {'nn_model_type': 'resnet_custom', 'resnet_hidden_dim': 64, 'resnet_num_blocks': 7, 'resnet_dropout': 0.053130625488418536, 'resnet_lr': 0.006961939223357535}. Best is trial 22 with value: 0.9749771944955573.[0m
Best trial: 22. Best value: 0.974977:  73%|█████████████▊     | 73/100 [13:48<04:48, 10.69s/it]Best trial: 22. Best value: 0.974977:  73%|█████████████▊     | 73/100 [13:48<04:48, 10.69s/it]Best trial: 22. Best value: 0.974977:  74%|██████████████     | 74/100 [13:48<04:29, 10.38s/it]Variance threshold: 40004 → 40004 features
🔥 AMD ROCm GPU detected: AMD Radeon RX 7700 XT
🚀 Using GPU: cuda:0 - AMD Radeon RX 7700 XT (12.0GB ROCm)
                                                                                               [32m[I 2025-08-04 15:01:00,755][0m Trial 74 finished with value: 0.971441803612584 and parameters: {'nn_model_type': 'resnet_custom', 'resnet_hidden_dim': 128, 'resnet_num_blocks': 4, 'resnet_dropout': 0.0002797502539713635, 'resnet_lr': 0.0034235416566076476}. Best is trial 22 with value: 0.9749771944955573.[0m
Best trial: 22. Best value: 0.974977:  74%|██████████████     | 74/100 [13:58<04:29, 10.38s/it]Best trial: 22. Best value: 0.974977:  74%|██████████████     | 74/100 [13:58<04:29, 10.38s/it]Best trial: 22. Best value: 0.974977:  75%|██████████████▎    | 75/100 [13:58<04:15, 10.22s/it]Variance threshold: 40004 → 40004 features
🔥 AMD ROCm GPU detected: AMD Radeon RX 7700 XT
🚀 Using GPU: cuda:0 - AMD Radeon RX 7700 XT (12.0GB ROCm)
