                                                                                               [32m[I 2025-08-04 15:01:11,908][0m Trial 75 finished with value: 0.9649451237175773 and parameters: {'nn_model_type': 'resnet_custom', 'resnet_hidden_dim': 192, 'resnet_num_blocks': 4, 'resnet_dropout': 0.01661231159573691, 'resnet_lr': 0.0029624421975986506}. Best is trial 22 with value: 0.9749771944955573.[0m
Best trial: 22. Best value: 0.974977:  75%|██████████████▎    | 75/100 [14:09<04:15, 10.22s/it]Best trial: 22. Best value: 0.974977:  75%|██████████████▎    | 75/100 [14:09<04:15, 10.22s/it]Best trial: 22. Best value: 0.974977:  76%|██████████████▍    | 76/100 [14:09<04:11, 10.50s/it]Variance threshold: 40004 → 40004 features
🔥 AMD ROCm GPU detected: AMD Radeon RX 7700 XT
🚀 Using GPU: cuda:0 - AMD Radeon RX 7700 XT (12.0GB ROCm)
                                                                                               [32m[I 2025-08-04 15:01:23,769][0m Trial 76 finished with value: -0.4097100140502592 and parameters: {'nn_model_type': 'simple_mlp', 'mlp_hidden_dim': 256, 'mlp_num_layers': 3, 'mlp_dropout': 0.2292329229445355, 'mlp_lr': 0.0005087801446175173}. Best is trial 22 with value: 0.9749771944955573.[0m
Best trial: 22. Best value: 0.974977:  76%|██████████████▍    | 76/100 [14:21<04:11, 10.50s/it]Best trial: 22. Best value: 0.974977:  76%|██████████████▍    | 76/100 [14:21<04:11, 10.50s/it]Best trial: 22. Best value: 0.974977:  77%|██████████████▋    | 77/100 [14:21<04:10, 10.91s/it]Variance threshold: 40004 → 40004 features
🔥 AMD ROCm GPU detected: AMD Radeon RX 7700 XT
🚀 Using GPU: cuda:0 - AMD Radeon RX 7700 XT (12.0GB ROCm)
                                                                                               [32m[I 2025-08-04 15:01:33,917][0m Trial 77 finished with value: 0.9623277565304474 and parameters: {'nn_model_type': 'resnet_custom', 'resnet_hidden_dim': 128, 'resnet_num_blocks': 5, 'resnet_dropout': 0.03640883181727441, 'resnet_lr': 0.002140562078810375}. Best is trial 22 with value: 0.9749771944955573.[0m
Best trial: 22. Best value: 0.974977:  77%|██████████████▋    | 77/100 [14:31<04:10, 10.91s/it]Best trial: 22. Best value: 0.974977:  77%|██████████████▋    | 77/100 [14:31<04:10, 10.91s/it]Best trial: 22. Best value: 0.974977:  78%|██████████████▊    | 78/100 [14:31<03:54, 10.68s/it]Variance threshold: 40004 → 40004 features
🔥 AMD ROCm GPU detected: AMD Radeon RX 7700 XT
🚀 Using GPU: cuda:0 - AMD Radeon RX 7700 XT (12.0GB ROCm)
                                                                                               [32m[I 2025-08-04 15:01:44,394][0m Trial 78 finished with value: 0.8949387723044738 and parameters: {'nn_model_type': 'resnet_custom', 'resnet_hidden_dim': 192, 'resnet_num_blocks': 2, 'resnet_dropout': 0.07653928802288215, 'resnet_lr': 0.00021214342973459877}. Best is trial 22 with value: 0.9749771944955573.[0m
Best trial: 22. Best value: 0.974977:  78%|██████████████▊    | 78/100 [14:41<03:54, 10.68s/it]Best trial: 22. Best value: 0.974977:  78%|██████████████▊    | 78/100 [14:41<03:54, 10.68s/it]Best trial: 22. Best value: 0.974977:  79%|███████████████    | 79/100 [14:41<03:42, 10.62s/it]Variance threshold: 40004 → 40004 features
🔥 AMD ROCm GPU detected: AMD Radeon RX 7700 XT
🚀 Using GPU: cuda:0 - AMD Radeon RX 7700 XT (12.0GB ROCm)
                                                                                               [32m[I 2025-08-04 15:01:54,155][0m Trial 79 finished with value: 0.969648781492409 and parameters: {'nn_model_type': 'resnet_custom', 'resnet_hidden_dim': 128, 'resnet_num_blocks': 4, 'resnet_dropout': 0.013406476080306816, 'resnet_lr': 0.0012107974329774356}. Best is trial 22 with value: 0.9749771944955573.[0m
Best trial: 22. Best value: 0.974977:  79%|███████████████    | 79/100 [14:51<03:42, 10.62s/it]Best trial: 22. Best value: 0.974977:  79%|███████████████    | 79/100 [14:51<03:42, 10.62s/it]Best trial: 22. Best value: 0.974977:  80%|███████████████▏   | 80/100 [14:51<03:27, 10.36s/it]Variance threshold: 40004 → 40004 features
🔥 AMD ROCm GPU detected: AMD Radeon RX 7700 XT
🚀 Using GPU: cuda:0 - AMD Radeon RX 7700 XT (12.0GB ROCm)
                                                                                               [32m[I 2025-08-04 15:02:04,112][0m Trial 80 finished with value: 0.9551468158592545 and parameters: {'nn_model_type': 'resnet_custom', 'resnet_hidden_dim': 128, 'resnet_num_blocks': 5, 'resnet_dropout': 0.01358007476008421, 'resnet_lr': 0.0006811667236683265}. Best is trial 22 with value: 0.9749771944955573.[0m
Best trial: 22. Best value: 0.974977:  80%|███████████████▏   | 80/100 [15:01<03:27, 10.36s/it]Best trial: 22. Best value: 0.974977:  80%|███████████████▏   | 80/100 [15:01<03:27, 10.36s/it]Best trial: 22. Best value: 0.974977:  81%|███████████████▍   | 81/100 [15:01<03:14, 10.24s/it]Variance threshold: 40004 → 40004 features
🔥 AMD ROCm GPU detected: AMD Radeon RX 7700 XT
🚀 Using GPU: cuda:0 - AMD Radeon RX 7700 XT (12.0GB ROCm)
                                                                                               [32m[I 2025-08-04 15:02:13,830][0m Trial 81 finished with value: 0.9711639583784889 and parameters: {'nn_model_type': 'resnet_custom', 'resnet_hidden_dim': 128, 'resnet_num_blocks': 4, 'resnet_dropout': 0.012801727274096342, 'resnet_lr': 0.0011787359592528041}. Best is trial 22 with value: 0.9749771944955573.[0m
Best trial: 22. Best value: 0.974977:  81%|███████████████▍   | 81/100 [15:11<03:14, 10.24s/it]Best trial: 22. Best value: 0.974977:  81%|███████████████▍   | 81/100 [15:11<03:14, 10.24s/it]Best trial: 22. Best value: 0.974977:  82%|███████████████▌   | 82/100 [15:11<03:01, 10.08s/it]Variance threshold: 40004 → 40004 features
🔥 AMD ROCm GPU detected: AMD Radeon RX 7700 XT
🚀 Using GPU: cuda:0 - AMD Radeon RX 7700 XT (12.0GB ROCm)
                                                                                               [32m[I 2025-08-04 15:02:23,530][0m Trial 82 finished with value: 0.972465535079461 and parameters: {'nn_model_type': 'resnet_custom', 'resnet_hidden_dim': 128, 'resnet_num_blocks': 4, 'resnet_dropout': 0.012349539787170323, 'resnet_lr': 0.0011525670650741747}. Best is trial 22 with value: 0.9749771944955573.[0m
Best trial: 22. Best value: 0.974977:  82%|███████████████▌   | 82/100 [15:20<03:01, 10.08s/it]Best trial: 22. Best value: 0.974977:  82%|███████████████▌   | 82/100 [15:20<03:01, 10.08s/it]Best trial: 22. Best value: 0.974977:  83%|███████████████▊   | 83/100 [15:20<02:49,  9.97s/it]Variance threshold: 40004 → 40004 features
🔥 AMD ROCm GPU detected: AMD Radeon RX 7700 XT
🚀 Using GPU: cuda:0 - AMD Radeon RX 7700 XT (12.0GB ROCm)
                                                                                               [32m[I 2025-08-04 15:02:34,504][0m Trial 83 finished with value: 0.9464366465341679 and parameters: {'nn_model_type': 'resnet_custom', 'resnet_hidden_dim': 192, 'resnet_num_blocks': 4, 'resnet_dropout': 0.03350407816256401, 'resnet_lr': 0.001809185827308564}. Best is trial 22 with value: 0.9749771944955573.[0m
Best trial: 22. Best value: 0.974977:  83%|███████████████▊   | 83/100 [15:31<02:49,  9.97s/it]Best trial: 22. Best value: 0.974977:  83%|███████████████▊   | 83/100 [15:31<02:49,  9.97s/it]Best trial: 22. Best value: 0.974977:  84%|███████████████▉   | 84/100 [15:31<02:44, 10.27s/it]Variance threshold: 40004 → 40004 features
🔥 AMD ROCm GPU detected: AMD Radeon RX 7700 XT
🚀 Using GPU: cuda:0 - AMD Radeon RX 7700 XT (12.0GB ROCm)
                                                                                               [32m[I 2025-08-04 15:02:44,198][0m Trial 84 finished with value: 0.966247986899727 and parameters: {'nn_model_type': 'resnet_custom', 'resnet_hidden_dim': 128, 'resnet_num_blocks': 4, 'resnet_dropout': 0.0010072311187784284, 'resnet_lr': 0.0010763271700258985}. Best is trial 22 with value: 0.9749771944955573.[0m
Best trial: 22. Best value: 0.974977:  84%|███████████████▉   | 84/100 [15:41<02:44, 10.27s/it]Best trial: 22. Best value: 0.974977:  84%|███████████████▉   | 84/100 [15:41<02:44, 10.27s/it]Best trial: 22. Best value: 0.974977:  85%|████████████████▏  | 85/100 [15:41<02:31, 10.10s/it]Variance threshold: 40004 → 40004 features
🔥 AMD ROCm GPU detected: AMD Radeon RX 7700 XT
🚀 Using GPU: cuda:0 - AMD Radeon RX 7700 XT (12.0GB ROCm)
                                                                                               [32m[I 2025-08-04 15:02:52,094][0m Trial 85 finished with value: -0.20219458623370593 and parameters: {'nn_model_type': 'wide_deep', 'wd_deep_layers': 3, 'wd_deep_base_dim': 128, 'wd_wide_ratio': 0.5624444791784186, 'wd_lr': 0.005148121479136061}. Best is trial 22 with value: 0.9749771944955573.[0m
Best trial: 22. Best value: 0.974977:  85%|████████████████▏  | 85/100 [15:49<02:31, 10.10s/it]Best trial: 22. Best value: 0.974977:  85%|████████████████▏  | 85/100 [15:49<02:31, 10.10s/it]Best trial: 22. Best value: 0.974977:  86%|████████████████▎  | 86/100 [15:49<02:12,  9.44s/it]Variance threshold: 40004 → 40004 features
🔥 AMD ROCm GPU detected: AMD Radeon RX 7700 XT
🚀 Using GPU: cuda:0 - AMD Radeon RX 7700 XT (12.0GB ROCm)
                                                                                               [32m[I 2025-08-04 15:03:02,340][0m Trial 86 finished with value: 0.9341151472102304 and parameters: {'nn_model_type': 'resnet_custom', 'resnet_hidden_dim': 128, 'resnet_num_blocks': 6, 'resnet_dropout': 0.013877659196744174, 'resnet_lr': 0.000815150318489886}. Best is trial 22 with value: 0.9749771944955573.[0m
Best trial: 22. Best value: 0.974977:  86%|████████████████▎  | 86/100 [15:59<02:12,  9.44s/it]Best trial: 22. Best value: 0.974977:  86%|████████████████▎  | 86/100 [15:59<02:12,  9.44s/it]Best trial: 22. Best value: 0.974977:  87%|████████████████▌  | 87/100 [15:59<02:05,  9.68s/it]Variance threshold: 40004 → 40004 features
🔥 AMD ROCm GPU detected: AMD Radeon RX 7700 XT
🚀 Using GPU: cuda:0 - AMD Radeon RX 7700 XT (12.0GB ROCm)
                                                                                               [32m[I 2025-08-04 15:03:11,573][0m Trial 87 finished with value: 0.9516272237686071 and parameters: {'nn_model_type': 'resnet_custom', 'resnet_hidden_dim': 128, 'resnet_num_blocks': 2, 'resnet_dropout': 0.04559933940693315, 'resnet_lr': 0.0013553646751591792}. Best is trial 22 with value: 0.9749771944955573.[0m
Best trial: 22. Best value: 0.974977:  87%|████████████████▌  | 87/100 [16:08<02:05,  9.68s/it]Best trial: 22. Best value: 0.974977:  87%|████████████████▌  | 87/100 [16:08<02:05,  9.68s/it]Best trial: 22. Best value: 0.974977:  88%|████████████████▋  | 88/100 [16:08<01:54,  9.55s/it]Variance threshold: 40004 → 40004 features
🔥 AMD ROCm GPU detected: AMD Radeon RX 7700 XT
🚀 Using GPU: cuda:0 - AMD Radeon RX 7700 XT (12.0GB ROCm)
                                                                                               [32m[I 2025-08-04 15:03:25,608][0m Trial 88 finished with value: -999.0 and parameters: {'nn_model_type': 'deep_mlp', 'deep_mlp_num_layers': 6, 'deep_mlp_base_dim': 384, 'deep_mlp_dropout': 0.3972659663446923, 'deep_mlp_lr': 0.0014949551188881294}. Best is trial 22 with value: 0.9749771944955573.[0m
Best trial: 22. Best value: 0.974977:  88%|████████████████▋  | 88/100 [16:22<01:54,  9.55s/it]Best trial: 22. Best value: 0.974977:  88%|████████████████▋  | 88/100 [16:22<01:54,  9.55s/it]Best trial: 22. Best value: 0.974977:  89%|████████████████▉  | 89/100 [16:22<01:59, 10.89s/it]Variance threshold: 40004 → 40004 features
🔥 AMD ROCm GPU detected: AMD Radeon RX 7700 XT
🚀 Using GPU: cuda:0 - AMD Radeon RX 7700 XT (12.0GB ROCm)
                                                                                               [32m[I 2025-08-04 15:03:36,214][0m Trial 89 finished with value: 0.9585900567053122 and parameters: {'nn_model_type': 'resnet_custom', 'resnet_hidden_dim': 192, 'resnet_num_blocks': 2, 'resnet_dropout': 0.029462297119601556, 'resnet_lr': 2.1934602092867412e-05}. Best is trial 22 with value: 0.9749771944955573.[0m
Best trial: 22. Best value: 0.974977:  89%|████████████████▉  | 89/100 [16:33<01:59, 10.89s/it]Best trial: 22. Best value: 0.974977:  89%|████████████████▉  | 89/100 [16:33<01:59, 10.89s/it]Best trial: 22. Best value: 0.974977:  90%|█████████████████  | 90/100 [16:33<01:48, 10.81s/it]Variance threshold: 40004 → 40004 features
🔥 AMD ROCm GPU detected: AMD Radeon RX 7700 XT
🚀 Using GPU: cuda:0 - AMD Radeon RX 7700 XT (12.0GB ROCm)
                                                                                               [32m[I 2025-08-04 15:03:42,688][0m Trial 90 finished with value: -999.0 and parameters: {'nn_model_type': 'deepfm', 'deepfm_embedding_dim': 10, 'deepfm_num_layers': 4, 'deepfm_base_dim': 192, 'deepfm_dropout': 0.1171068364627938, 'deepfm_lr': 2.5154670734412683e-05}. Best is trial 22 with value: 0.9749771944955573.[0m
Best trial: 22. Best value: 0.974977:  90%|█████████████████  | 90/100 [16:40<01:48, 10.81s/it]Best trial: 22. Best value: 0.974977:  90%|█████████████████  | 90/100 [16:40<01:48, 10.81s/it]Best trial: 22. Best value: 0.974977:  91%|█████████████████▎ | 91/100 [16:40<01:25,  9.51s/it]Variance threshold: 40004 → 40004 features
🔥 AMD ROCm GPU detected: AMD Radeon RX 7700 XT
🚀 Using GPU: cuda:0 - AMD Radeon RX 7700 XT (12.0GB ROCm)
                                                                                               [32m[I 2025-08-04 15:03:52,787][0m Trial 91 finished with value: 0.9696241818466594 and parameters: {'nn_model_type': 'resnet_custom', 'resnet_hidden_dim': 128, 'resnet_num_blocks': 4, 'resnet_dropout': 0.011904645279410205, 'resnet_lr': 0.0012337742851972115}. Best is trial 22 with value: 0.9749771944955573.[0m
Best trial: 22. Best value: 0.974977:  91%|█████████████████▎ | 91/100 [16:50<01:25,  9.51s/it]Best trial: 22. Best value: 0.974977:  91%|█████████████████▎ | 91/100 [16:50<01:25,  9.51s/it]Best trial: 22. Best value: 0.974977:  92%|█████████████████▍ | 92/100 [16:50<01:17,  9.68s/it]Variance threshold: 40004 → 40004 features
🔥 AMD ROCm GPU detected: AMD Radeon RX 7700 XT
🚀 Using GPU: cuda:0 - AMD Radeon RX 7700 XT (12.0GB ROCm)
                                                                                               [32m[I 2025-08-04 15:04:03,149][0m Trial 92 finished with value: 0.9710233088717674 and parameters: {'nn_model_type': 'resnet_custom', 'resnet_hidden_dim': 128, 'resnet_num_blocks': 4, 'resnet_dropout': 0.011839166914289979, 'resnet_lr': 0.0026985371859295925}. Best is trial 22 with value: 0.9749771944955573.[0m
Best trial: 22. Best value: 0.974977:  92%|█████████████████▍ | 92/100 [17:00<01:17,  9.68s/it]Best trial: 22. Best value: 0.974977:  92%|█████████████████▍ | 92/100 [17:00<01:17,  9.68s/it]Best trial: 22. Best value: 0.974977:  93%|█████████████████▋ | 93/100 [17:00<01:09,  9.89s/it]Variance threshold: 40004 → 40004 features
🔥 AMD ROCm GPU detected: AMD Radeon RX 7700 XT
🚀 Using GPU: cuda:0 - AMD Radeon RX 7700 XT (12.0GB ROCm)
                                                                                               [32m[I 2025-08-04 15:04:13,609][0m Trial 93 finished with value: 0.9682019162079131 and parameters: {'nn_model_type': 'resnet_custom', 'resnet_hidden_dim': 128, 'resnet_num_blocks': 4, 'resnet_dropout': 0.0005141602979927811, 'resnet_lr': 0.002687260821489776}. Best is trial 22 with value: 0.9749771944955573.[0m
Best trial: 22. Best value: 0.974977:  93%|█████████████████▋ | 93/100 [17:10<01:09,  9.89s/it]Best trial: 22. Best value: 0.974977:  93%|█████████████████▋ | 93/100 [17:10<01:09,  9.89s/it]Best trial: 22. Best value: 0.974977:  94%|█████████████████▊ | 94/100 [17:10<01:00, 10.06s/it]Variance threshold: 40004 → 40004 features
🔥 AMD ROCm GPU detected: AMD Radeon RX 7700 XT
🚀 Using GPU: cuda:0 - AMD Radeon RX 7700 XT (12.0GB ROCm)
                                                                                               [32m[I 2025-08-04 15:04:25,352][0m Trial 94 finished with value: 0.9554528114778266 and parameters: {'nn_model_type': 'resnet_custom', 'resnet_hidden_dim': 192, 'resnet_num_blocks': 4, 'resnet_dropout': 0.010461739311003807, 'resnet_lr': 0.004459437203063877}. Best is trial 22 with value: 0.9749771944955573.[0m
Best trial: 22. Best value: 0.974977:  94%|█████████████████▊ | 94/100 [17:22<01:00, 10.06s/it]Best trial: 22. Best value: 0.974977:  94%|█████████████████▊ | 94/100 [17:22<01:00, 10.06s/it]Best trial: 22. Best value: 0.974977:  95%|██████████████████ | 95/100 [17:22<00:52, 10.56s/it]Variance threshold: 40004 → 40004 features
🔥 AMD ROCm GPU detected: AMD Radeon RX 7700 XT
🚀 Using GPU: cuda:0 - AMD Radeon RX 7700 XT (12.0GB ROCm)
                                                                                               [32m[I 2025-08-04 15:04:35,976][0m Trial 95 finished with value: 0.9623819998334356 and parameters: {'nn_model_type': 'resnet_custom', 'resnet_hidden_dim': 128, 'resnet_num_blocks': 5, 'resnet_dropout': 0.024465867320179566, 'resnet_lr': 5.485950296283687e-05}. Best is trial 22 with value: 0.9749771944955573.[0m
Best trial: 22. Best value: 0.974977:  95%|██████████████████ | 95/100 [17:33<00:52, 10.56s/it]Best trial: 22. Best value: 0.974977:  95%|██████████████████ | 95/100 [17:33<00:52, 10.56s/it]Best trial: 22. Best value: 0.974977:  96%|██████████████████▏| 96/100 [17:33<00:42, 10.58s/it]Variance threshold: 40004 → 40004 features
🔥 AMD ROCm GPU detected: AMD Radeon RX 7700 XT
🚀 Using GPU: cuda:0 - AMD Radeon RX 7700 XT (12.0GB ROCm)
                                                                                               [32m[I 2025-08-04 15:04:45,985][0m Trial 96 finished with value: 0.9492021215020182 and parameters: {'nn_model_type': 'resnet_custom', 'resnet_hidden_dim': 128, 'resnet_num_blocks': 2, 'resnet_dropout': 0.060118569648294484, 'resnet_lr': 0.0025844218316137687}. Best is trial 22 with value: 0.9749771944955573.[0m
Best trial: 22. Best value: 0.974977:  96%|██████████████████▏| 96/100 [17:43<00:42, 10.58s/it]Best trial: 22. Best value: 0.974977:  96%|██████████████████▏| 96/100 [17:43<00:42, 10.58s/it]Best trial: 22. Best value: 0.974977:  97%|██████████████████▍| 97/100 [17:43<00:31, 10.41s/it]Variance threshold: 40004 → 40004 features
🔥 AMD ROCm GPU detected: AMD Radeon RX 7700 XT
🚀 Using GPU: cuda:0 - AMD Radeon RX 7700 XT (12.0GB ROCm)
                                                                                               [32m[I 2025-08-04 15:04:56,527][0m Trial 97 finished with value: -999.0 and parameters: {'nn_model_type': 'dcn', 'dcn_cross_layers': 2, 'dcn_deep_layers': 3, 'dcn_base_dim': 384, 'dcn_dropout': 0.2925020535946533, 'dcn_lr': 0.0001731221441634085}. Best is trial 22 with value: 0.9749771944955573.[0m
Best trial: 22. Best value: 0.974977:  97%|██████████████████▍| 97/100 [17:53<00:31, 10.41s/it]Best trial: 22. Best value: 0.974977:  97%|██████████████████▍| 97/100 [17:53<00:31, 10.41s/it]Best trial: 22. Best value: 0.974977:  98%|██████████████████▌| 98/100 [17:53<00:20, 10.45s/it]Variance threshold: 40004 → 40004 features
🔥 AMD ROCm GPU detected: AMD Radeon RX 7700 XT
🚀 Using GPU: cuda:0 - AMD Radeon RX 7700 XT (12.0GB ROCm)
                                                                                               [32m[I 2025-08-04 15:05:15,861][0m Trial 98 finished with value: -0.7222495961897805 and parameters: {'nn_model_type': 'simple_mlp', 'mlp_hidden_dim': 512, 'mlp_num_layers': 6, 'mlp_dropout': 0.19881302502583345, 'mlp_lr': 6.164633874103754e-05}. Best is trial 22 with value: 0.9749771944955573.[0m
Best trial: 22. Best value: 0.974977:  98%|██████████████████▌| 98/100 [18:13<00:20, 10.45s/it]Best trial: 22. Best value: 0.974977:  98%|██████████████████▌| 98/100 [18:13<00:20, 10.45s/it]Best trial: 22. Best value: 0.974977:  99%|██████████████████▊| 99/100 [18:13<00:13, 13.12s/it]Variance threshold: 40004 → 40004 features
🔥 AMD ROCm GPU detected: AMD Radeon RX 7700 XT
🚀 Using GPU: cuda:0 - AMD Radeon RX 7700 XT (12.0GB ROCm)
                                                                                               [32m[I 2025-08-04 15:05:26,425][0m Trial 99 finished with value: 0.8776631110175996 and parameters: {'nn_model_type': 'resnet_custom', 'resnet_hidden_dim': 192, 'resnet_num_blocks': 2, 'resnet_dropout': 0.13141001841514266, 'resnet_lr': 0.0018779290736018431}. Best is trial 22 with value: 0.9749771944955573.[0m
Best trial: 22. Best value: 0.974977:  99%|██████████████████▊| 99/100 [18:23<00:13, 13.12s/it]Best trial: 22. Best value: 0.974977:  99%|██████████████████▊| 99/100 [18:23<00:13, 13.12s/it]Best trial: 22. Best value: 0.974977: 100%|██████████████████| 100/100 [18:23<00:00, 12.35s/it]Best trial: 22. Best value: 0.974977: 100%|██████████████████| 100/100 [18:23<00:00, 11.04s/it]
[92m✅ Best Neural Network R²: 0.9750[0m
[1m[93m🎯 Phase 3: Final Evaluation[0m
🔥 AMD ROCm GPU detected: AMD Radeon RX 7700 XT
🏆 Training final model with best parameters for inference...
  Epoch 20/100, Loss: 0.438611
  Epoch 40/100, Loss: 0.390898
  Epoch 60/100, Loss: 1.652487
  Epoch 80/100, Loss: 0.385465
  Epoch 100/100, Loss: 0.564938
💾 Model weights saved to: best_model_hold5/hold5_final_model.pt
💾 Model artifacts saved
├── best_model_hold5/hold5_final_model.pkl
├── scaler saved
├── var_threshold saved
├── kbest_selector saved
└── best_model_hold5/hold5_results.txt
📋 FINAL SUMMARY - Hold 5
├── 🧪 Test set R²: 0.9617
├── 📏 Noise ceiling: 0.9900
├── 📐 Test MAE: 0.5171
└── 📈 Room for improvement

[1m[92m🎉 Optimization Complete![0m
Final Test R²: 0.961742403338808
[1m[92m🎯 TARGET ACHIEVED: R² = 0.9617 >= 0.95[0m
