                                                                                               [32m[I 2025-08-04 14:52:17,168][0m Trial 24 finished with value: 0.9241616469669557 and parameters: {'nn_model_type': 'resnet_custom', 'resnet_hidden_dim': 128, 'resnet_num_blocks': 2, 'resnet_dropout': 0.06793620808238976, 'resnet_lr': 3.0199408002576054e-05}. Best is trial 22 with value: 0.9749771944955573.[0m
Best trial: 22. Best value: 0.974977:  24%|████▌              | 24/100 [05:14<14:24, 11.38s/it]Best trial: 22. Best value: 0.974977:  24%|████▌              | 24/100 [05:14<14:24, 11.38s/it]Best trial: 22. Best value: 0.974977:  25%|████▊              | 25/100 [05:14<13:43, 10.98s/it]Variance threshold: 40004 → 40004 features
🔥 AMD ROCm GPU detected: AMD Radeon RX 7700 XT
🚀 Using GPU: cuda:0 - AMD Radeon RX 7700 XT (12.0GB ROCm)
                                                                                               [32m[I 2025-08-04 14:52:27,649][0m Trial 25 finished with value: 0.7672411493528716 and parameters: {'nn_model_type': 'resnet_custom', 'resnet_hidden_dim': 128, 'resnet_num_blocks': 2, 'resnet_dropout': 0.1525666723403356, 'resnet_lr': 0.00023513548914194294}. Best is trial 22 with value: 0.9749771944955573.[0m
Best trial: 22. Best value: 0.974977:  25%|████▊              | 25/100 [05:24<13:43, 10.98s/it]Best trial: 22. Best value: 0.974977:  25%|████▊              | 25/100 [05:24<13:43, 10.98s/it]Best trial: 22. Best value: 0.974977:  26%|████▉              | 26/100 [05:24<13:21, 10.83s/it]Variance threshold: 40004 → 40004 features
🔥 AMD ROCm GPU detected: AMD Radeon RX 7700 XT
🚀 Using GPU: cuda:0 - AMD Radeon RX 7700 XT (12.0GB ROCm)
                                                                                               [32m[I 2025-08-04 14:52:36,428][0m Trial 26 finished with value: -999.0 and parameters: {'nn_model_type': 'deepfm', 'deepfm_embedding_dim': 8, 'deepfm_num_layers': 5, 'deepfm_base_dim': 512, 'deepfm_dropout': 0.006184793792058357, 'deepfm_lr': 6.503871172413049e-05}. Best is trial 22 with value: 0.9749771944955573.[0m
Best trial: 22. Best value: 0.974977:  26%|████▉              | 26/100 [05:33<13:21, 10.83s/it]Best trial: 22. Best value: 0.974977:  26%|████▉              | 26/100 [05:33<13:21, 10.83s/it]Best trial: 22. Best value: 0.974977:  27%|█████▏             | 27/100 [05:33<12:25, 10.22s/it]Variance threshold: 40004 → 40004 features
🔥 AMD ROCm GPU detected: AMD Radeon RX 7700 XT
🚀 Using GPU: cuda:0 - AMD Radeon RX 7700 XT (12.0GB ROCm)
                                                                                               [32m[I 2025-08-04 14:52:47,417][0m Trial 27 finished with value: -999.0 and parameters: {'nn_model_type': 'dcn', 'dcn_cross_layers': 2, 'dcn_deep_layers': 5, 'dcn_base_dim': 448, 'dcn_dropout': 0.20314251845605044, 'dcn_lr': 1.3286478128619268e-05}. Best is trial 22 with value: 0.9749771944955573.[0m
Best trial: 22. Best value: 0.974977:  27%|█████▏             | 27/100 [05:44<12:25, 10.22s/it]Best trial: 22. Best value: 0.974977:  27%|█████▏             | 27/100 [05:44<12:25, 10.22s/it]Best trial: 22. Best value: 0.974977:  28%|█████▎             | 28/100 [05:44<12:32, 10.45s/it]Variance threshold: 40004 → 40004 features
🔥 AMD ROCm GPU detected: AMD Radeon RX 7700 XT
🚀 Using GPU: cuda:0 - AMD Radeon RX 7700 XT (12.0GB ROCm)
                                                                                               [32m[I 2025-08-04 14:52:53,644][0m Trial 28 finished with value: -999.0 and parameters: {'nn_model_type': 'simple_mlp', 'mlp_hidden_dim': 512, 'mlp_num_layers': 6, 'mlp_dropout': 0.4874587905975352, 'mlp_lr': 4.108968603287427e-05}. Best is trial 22 with value: 0.9749771944955573.[0m
Best trial: 22. Best value: 0.974977:  28%|█████▎             | 28/100 [05:50<12:32, 10.45s/it]Best trial: 22. Best value: 0.974977:  28%|█████▎             | 28/100 [05:50<12:32, 10.45s/it]Best trial: 22. Best value: 0.974977:  29%|█████▌             | 29/100 [05:50<10:51,  9.18s/it]Variance threshold: 40004 → 40004 features
🔥 AMD ROCm GPU detected: AMD Radeon RX 7700 XT
🚀 Using GPU: cuda:0 - AMD Radeon RX 7700 XT (12.0GB ROCm)
                                                                                               [32m[I 2025-08-04 14:53:02,721][0m Trial 29 finished with value: -2.1589152457378757 and parameters: {'nn_model_type': 'wide_deep', 'wd_deep_layers': 5, 'wd_deep_base_dim': 128, 'wd_wide_ratio': 0.25273357341857466, 'wd_lr': 0.0058537066340927126}. Best is trial 22 with value: 0.9749771944955573.[0m
Best trial: 22. Best value: 0.974977:  29%|█████▌             | 29/100 [06:00<10:51,  9.18s/it]Best trial: 22. Best value: 0.974977:  29%|█████▌             | 29/100 [06:00<10:51,  9.18s/it]Best trial: 22. Best value: 0.974977:  30%|█████▋             | 30/100 [06:00<10:40,  9.15s/it]Variance threshold: 40004 → 40004 features
🔥 AMD ROCm GPU detected: AMD Radeon RX 7700 XT
🚀 Using GPU: cuda:0 - AMD Radeon RX 7700 XT (12.0GB ROCm)
                                                                                               [32m[I 2025-08-04 14:53:11,660][0m Trial 30 finished with value: 0.9449950611178708 and parameters: {'nn_model_type': 'wide_deep', 'wd_deep_layers': 2, 'wd_deep_base_dim': 512, 'wd_wide_ratio': 0.7539552041528113, 'wd_lr': 3.4673306900175566e-05}. Best is trial 22 with value: 0.9749771944955573.[0m
Best trial: 22. Best value: 0.974977:  30%|█████▋             | 30/100 [06:08<10:40,  9.15s/it]Best trial: 22. Best value: 0.974977:  30%|█████▋             | 30/100 [06:08<10:40,  9.15s/it]Best trial: 22. Best value: 0.974977:  31%|█████▉             | 31/100 [06:08<10:27,  9.09s/it]Variance threshold: 40004 → 40004 features
🔥 AMD ROCm GPU detected: AMD Radeon RX 7700 XT
🚀 Using GPU: cuda:0 - AMD Radeon RX 7700 XT (12.0GB ROCm)
                                                                                               [32m[I 2025-08-04 14:53:22,021][0m Trial 31 finished with value: 0.9564740721678225 and parameters: {'nn_model_type': 'resnet_custom', 'resnet_hidden_dim': 192, 'resnet_num_blocks': 2, 'resnet_dropout': 0.0006632459791679176, 'resnet_lr': 0.0028410821210718157}. Best is trial 22 with value: 0.9749771944955573.[0m
Best trial: 22. Best value: 0.974977:  31%|█████▉             | 31/100 [06:19<10:27,  9.09s/it]Best trial: 22. Best value: 0.974977:  31%|█████▉             | 31/100 [06:19<10:27,  9.09s/it]Best trial: 22. Best value: 0.974977:  32%|██████             | 32/100 [06:19<10:43,  9.47s/it]Variance threshold: 40004 → 40004 features
🔥 AMD ROCm GPU detected: AMD Radeon RX 7700 XT
🚀 Using GPU: cuda:0 - AMD Radeon RX 7700 XT (12.0GB ROCm)
                                                                                               [32m[I 2025-08-04 14:53:31,460][0m Trial 32 finished with value: 0.964261351291324 and parameters: {'nn_model_type': 'resnet_custom', 'resnet_hidden_dim': 128, 'resnet_num_blocks': 3, 'resnet_dropout': 0.04429176356718213, 'resnet_lr': 0.0013255172540236008}. Best is trial 22 with value: 0.9749771944955573.[0m
Best trial: 22. Best value: 0.974977:  32%|██████             | 32/100 [06:28<10:43,  9.47s/it]Best trial: 22. Best value: 0.974977:  32%|██████             | 32/100 [06:28<10:43,  9.47s/it]Best trial: 22. Best value: 0.974977:  33%|██████▎            | 33/100 [06:28<10:33,  9.46s/it]Variance threshold: 40004 → 40004 features
🔥 AMD ROCm GPU detected: AMD Radeon RX 7700 XT
🚀 Using GPU: cuda:0 - AMD Radeon RX 7700 XT (12.0GB ROCm)
                                                                                               [32m[I 2025-08-04 14:53:43,012][0m Trial 33 finished with value: 0.9593195826524492 and parameters: {'nn_model_type': 'resnet_custom', 'resnet_hidden_dim': 256, 'resnet_num_blocks': 2, 'resnet_dropout': 0.0071412048855509745, 'resnet_lr': 0.0038243452508823746}. Best is trial 22 with value: 0.9749771944955573.[0m
Best trial: 22. Best value: 0.974977:  33%|██████▎            | 33/100 [06:40<10:33,  9.46s/it]Best trial: 22. Best value: 0.974977:  33%|██████▎            | 33/100 [06:40<10:33,  9.46s/it]Best trial: 22. Best value: 0.974977:  34%|██████▍            | 34/100 [06:40<11:05, 10.09s/it]Variance threshold: 40004 → 40004 features
🔥 AMD ROCm GPU detected: AMD Radeon RX 7700 XT
🚀 Using GPU: cuda:0 - AMD Radeon RX 7700 XT (12.0GB ROCm)
                                                                                               [32m[I 2025-08-04 14:53:52,930][0m Trial 34 finished with value: 0.9007764211648448 and parameters: {'nn_model_type': 'resnet_custom', 'resnet_hidden_dim': 128, 'resnet_num_blocks': 4, 'resnet_dropout': 0.09861813585275682, 'resnet_lr': 0.00477075959461056}. Best is trial 22 with value: 0.9749771944955573.[0m
Best trial: 22. Best value: 0.974977:  34%|██████▍            | 34/100 [06:50<11:05, 10.09s/it]Best trial: 22. Best value: 0.974977:  34%|██████▍            | 34/100 [06:50<11:05, 10.09s/it]Best trial: 22. Best value: 0.974977:  35%|██████▋            | 35/100 [06:50<10:52, 10.04s/it]Variance threshold: 40004 → 40004 features
🔥 AMD ROCm GPU detected: AMD Radeon RX 7700 XT
🚀 Using GPU: cuda:0 - AMD Radeon RX 7700 XT (12.0GB ROCm)
                                                                                               [32m[I 2025-08-04 14:53:59,135][0m Trial 35 finished with value: -999.0 and parameters: {'nn_model_type': 'deepfm', 'deepfm_embedding_dim': 56, 'deepfm_num_layers': 2, 'deepfm_base_dim': 128, 'deepfm_dropout': 0.2802760977746398, 'deepfm_lr': 0.00994189172072187}. Best is trial 22 with value: 0.9749771944955573.[0m
Best trial: 22. Best value: 0.974977:  35%|██████▋            | 35/100 [06:56<10:52, 10.04s/it]Best trial: 22. Best value: 0.974977:  35%|██████▋            | 35/100 [06:56<10:52, 10.04s/it]Best trial: 22. Best value: 0.974977:  36%|██████▊            | 36/100 [06:56<09:28,  8.89s/it]Variance threshold: 40004 → 40004 features
🔥 AMD ROCm GPU detected: AMD Radeon RX 7700 XT
🚀 Using GPU: cuda:0 - AMD Radeon RX 7700 XT (12.0GB ROCm)
                                                                                               [32m[I 2025-08-04 14:54:12,310][0m Trial 36 finished with value: 0.9628838303508892 and parameters: {'nn_model_type': 'resnet_custom', 'resnet_hidden_dim': 320, 'resnet_num_blocks': 2, 'resnet_dropout': 0.03930950707474326, 'resnet_lr': 0.0010821912016263022}. Best is trial 22 with value: 0.9749771944955573.[0m
Best trial: 22. Best value: 0.974977:  36%|██████▊            | 36/100 [07:09<09:28,  8.89s/it]Best trial: 22. Best value: 0.974977:  36%|██████▊            | 36/100 [07:09<09:28,  8.89s/it]Best trial: 22. Best value: 0.974977:  37%|███████            | 37/100 [07:09<10:40, 10.17s/it]Variance threshold: 40004 → 40004 features
🔥 AMD ROCm GPU detected: AMD Radeon RX 7700 XT
🚀 Using GPU: cuda:0 - AMD Radeon RX 7700 XT (12.0GB ROCm)
                                                                                               [32m[I 2025-08-04 14:54:28,338][0m Trial 37 finished with value: -999.0 and parameters: {'nn_model_type': 'dcn', 'dcn_cross_layers': 6, 'dcn_deep_layers': 2, 'dcn_base_dim': 128, 'dcn_dropout': 0.01607486773862926, 'dcn_lr': 0.009071975111769307}. Best is trial 22 with value: 0.9749771944955573.[0m
Best trial: 22. Best value: 0.974977:  37%|███████            | 37/100 [07:25<10:40, 10.17s/it]Best trial: 22. Best value: 0.974977:  37%|███████            | 37/100 [07:25<10:40, 10.17s/it]Best trial: 22. Best value: 0.974977:  38%|███████▏           | 38/100 [07:25<12:19, 11.93s/it]Variance threshold: 40004 → 40004 features
🔥 AMD ROCm GPU detected: AMD Radeon RX 7700 XT
🚀 Using GPU: cuda:0 - AMD Radeon RX 7700 XT (12.0GB ROCm)
                                                                                               [32m[I 2025-08-04 14:54:36,451][0m Trial 38 finished with value: 0.9294958343620529 and parameters: {'nn_model_type': 'simple_mlp', 'mlp_hidden_dim': 64, 'mlp_num_layers': 2, 'mlp_dropout': 0.01999834328719663, 'mlp_lr': 0.009734010547059874}. Best is trial 22 with value: 0.9749771944955573.[0m
Best trial: 22. Best value: 0.974977:  38%|███████▏           | 38/100 [07:33<12:19, 11.93s/it]Best trial: 22. Best value: 0.974977:  38%|███████▏           | 38/100 [07:33<12:19, 11.93s/it]Best trial: 22. Best value: 0.974977:  39%|███████▍           | 39/100 [07:33<10:57, 10.78s/it]Variance threshold: 40004 → 40004 features
🔥 AMD ROCm GPU detected: AMD Radeon RX 7700 XT
🚀 Using GPU: cuda:0 - AMD Radeon RX 7700 XT (12.0GB ROCm)
                                                                                               [32m[I 2025-08-04 14:54:45,895][0m Trial 39 finished with value: -999.0 and parameters: {'nn_model_type': 'resnet_custom', 'resnet_hidden_dim': 128, 'resnet_num_blocks': 3, 'resnet_dropout': 0.2954276047920695, 'resnet_lr': 0.00040095889448924367}. Best is trial 22 with value: 0.9749771944955573.[0m
Best trial: 22. Best value: 0.974977:  39%|███████▍           | 39/100 [07:43<10:57, 10.78s/it]Best trial: 22. Best value: 0.974977:  39%|███████▍           | 39/100 [07:43<10:57, 10.78s/it]Best trial: 22. Best value: 0.974977:  40%|███████▌           | 40/100 [07:43<10:22, 10.38s/it]Variance threshold: 40004 → 40004 features
🔥 AMD ROCm GPU detected: AMD Radeon RX 7700 XT
🚀 Using GPU: cuda:0 - AMD Radeon RX 7700 XT (12.0GB ROCm)
                                                                                               [32m[I 2025-08-04 14:54:55,215][0m Trial 40 finished with value: 0.19611925484289225 and parameters: {'nn_model_type': 'wide_deep', 'wd_deep_layers': 5, 'wd_deep_base_dim': 320, 'wd_wide_ratio': 0.5528068489930814, 'wd_lr': 0.0002400067922853061}. Best is trial 22 with value: 0.9749771944955573.[0m
Best trial: 22. Best value: 0.974977:  40%|███████▌           | 40/100 [07:52<10:22, 10.38s/it]Best trial: 22. Best value: 0.974977:  40%|███████▌           | 40/100 [07:52<10:22, 10.38s/it]Best trial: 22. Best value: 0.974977:  41%|███████▊           | 41/100 [07:52<09:53, 10.06s/it]Variance threshold: 40004 → 40004 features
🔥 AMD ROCm GPU detected: AMD Radeon RX 7700 XT
🚀 Using GPU: cuda:0 - AMD Radeon RX 7700 XT (12.0GB ROCm)
                                                                                               [32m[I 2025-08-04 14:55:03,900][0m Trial 41 finished with value: 0.9660392458672787 and parameters: {'nn_model_type': 'resnet_custom', 'resnet_hidden_dim': 64, 'resnet_num_blocks': 3, 'resnet_dropout': 0.034399665296802134, 'resnet_lr': 0.002552128704491339}. Best is trial 22 with value: 0.9749771944955573.[0m
Best trial: 22. Best value: 0.974977:  41%|███████▊           | 41/100 [08:01<09:53, 10.06s/it]Best trial: 22. Best value: 0.974977:  41%|███████▊           | 41/100 [08:01<09:53, 10.06s/it]Best trial: 22. Best value: 0.974977:  42%|███████▉           | 42/100 [08:01<09:19,  9.65s/it]Variance threshold: 40004 → 40004 features
🔥 AMD ROCm GPU detected: AMD Radeon RX 7700 XT
🚀 Using GPU: cuda:0 - AMD Radeon RX 7700 XT (12.0GB ROCm)
                                                                                               [32m[I 2025-08-04 14:55:12,800][0m Trial 42 finished with value: 0.9587222434417227 and parameters: {'nn_model_type': 'resnet_custom', 'resnet_hidden_dim': 64, 'resnet_num_blocks': 4, 'resnet_dropout': 0.031543097548018505, 'resnet_lr': 0.0014410326492781433}. Best is trial 22 with value: 0.9749771944955573.[0m
Best trial: 22. Best value: 0.974977:  42%|███████▉           | 42/100 [08:10<09:19,  9.65s/it]Best trial: 22. Best value: 0.974977:  42%|███████▉           | 42/100 [08:10<09:19,  9.65s/it]Best trial: 22. Best value: 0.974977:  43%|████████▏          | 43/100 [08:10<08:57,  9.43s/it]Variance threshold: 40004 → 40004 features
🔥 AMD ROCm GPU detected: AMD Radeon RX 7700 XT
🚀 Using GPU: cuda:0 - AMD Radeon RX 7700 XT (12.0GB ROCm)
                                                                                               [32m[I 2025-08-04 14:55:21,460][0m Trial 43 finished with value: 0.9695380809205215 and parameters: {'nn_model_type': 'resnet_custom', 'resnet_hidden_dim': 64, 'resnet_num_blocks': 3, 'resnet_dropout': 0.0007178447866995046, 'resnet_lr': 0.005581272100631099}. Best is trial 22 with value: 0.9749771944955573.[0m
Best trial: 22. Best value: 0.974977:  43%|████████▏          | 43/100 [08:18<08:57,  9.43s/it]Best trial: 22. Best value: 0.974977:  43%|████████▏          | 43/100 [08:18<08:57,  9.43s/it]Best trial: 22. Best value: 0.974977:  44%|████████▎          | 44/100 [08:18<08:34,  9.20s/it]Variance threshold: 40004 → 40004 features
🔥 AMD ROCm GPU detected: AMD Radeon RX 7700 XT
🚀 Using GPU: cuda:0 - AMD Radeon RX 7700 XT (12.0GB ROCm)
                                                                                               [32m[I 2025-08-04 14:55:36,773][0m Trial 44 finished with value: -999.0 and parameters: {'nn_model_type': 'deep_mlp', 'deep_mlp_num_layers': 8, 'deep_mlp_base_dim': 512, 'deep_mlp_dropout': 0.11809416678329374, 'deep_mlp_lr': 1.1641036405246155e-05}. Best is trial 22 with value: 0.9749771944955573.[0m
Best trial: 22. Best value: 0.974977:  44%|████████▎          | 44/100 [08:34<08:34,  9.20s/it]Best trial: 22. Best value: 0.974977:  44%|████████▎          | 44/100 [08:34<08:34,  9.20s/it]Best trial: 22. Best value: 0.974977:  45%|████████▌          | 45/100 [08:34<10:06, 11.03s/it]Variance threshold: 40004 → 40004 features
🔥 AMD ROCm GPU detected: AMD Radeon RX 7700 XT
🚀 Using GPU: cuda:0 - AMD Radeon RX 7700 XT (12.0GB ROCm)
                                                                                               [32m[I 2025-08-04 14:55:45,932][0m Trial 45 finished with value: 0.9589913802603666 and parameters: {'nn_model_type': 'resnet_custom', 'resnet_hidden_dim': 128, 'resnet_num_blocks': 2, 'resnet_dropout': 0.0026328377356779893, 'resnet_lr': 0.00560059271302001}. Best is trial 22 with value: 0.9749771944955573.[0m
Best trial: 22. Best value: 0.974977:  45%|████████▌          | 45/100 [08:43<10:06, 11.03s/it]Best trial: 22. Best value: 0.974977:  45%|████████▌          | 45/100 [08:43<10:06, 11.03s/it]Best trial: 22. Best value: 0.974977:  46%|████████▋          | 46/100 [08:43<09:25, 10.47s/it]Variance threshold: 40004 → 40004 features
🔥 AMD ROCm GPU detected: AMD Radeon RX 7700 XT
🚀 Using GPU: cuda:0 - AMD Radeon RX 7700 XT (12.0GB ROCm)
                                                                                               [32m[I 2025-08-04 14:55:56,277][0m Trial 46 finished with value: 0.9404711272231842 and parameters: {'nn_model_type': 'resnet_custom', 'resnet_hidden_dim': 192, 'resnet_num_blocks': 2, 'resnet_dropout': 0.0520892005019355, 'resnet_lr': 0.0052459616984172055}. Best is trial 22 with value: 0.9749771944955573.[0m
Best trial: 22. Best value: 0.974977:  46%|████████▋          | 46/100 [08:53<09:25, 10.47s/it]Best trial: 22. Best value: 0.974977:  46%|████████▋          | 46/100 [08:53<09:25, 10.47s/it]Best trial: 22. Best value: 0.974977:  47%|████████▉          | 47/100 [08:53<09:12, 10.43s/it]Variance threshold: 40004 → 40004 features
🔥 AMD ROCm GPU detected: AMD Radeon RX 7700 XT
🚀 Using GPU: cuda:0 - AMD Radeon RX 7700 XT (12.0GB ROCm)
                                                                                               [32m[I 2025-08-04 14:56:04,969][0m Trial 47 finished with value: 0.9564566594548234 and parameters: {'nn_model_type': 'resnet_custom', 'resnet_hidden_dim': 64, 'resnet_num_blocks': 3, 'resnet_dropout': 0.020800910091764685, 'resnet_lr': 0.005923658029054025}. Best is trial 22 with value: 0.9749771944955573.[0m
Best trial: 22. Best value: 0.974977:  47%|████████▉          | 47/100 [09:02<09:12, 10.43s/it]Best trial: 22. Best value: 0.974977:  47%|████████▉          | 47/100 [09:02<09:12, 10.43s/it]Best trial: 22. Best value: 0.974977:  48%|█████████          | 48/100 [09:02<08:35,  9.91s/it]Variance threshold: 40004 → 40004 features
🔥 AMD ROCm GPU detected: AMD Radeon RX 7700 XT
🚀 Using GPU: cuda:0 - AMD Radeon RX 7700 XT (12.0GB ROCm)
                                                                                               [32m[I 2025-08-04 14:56:20,183][0m Trial 48 finished with value: -999.0 and parameters: {'nn_model_type': 'deep_mlp', 'deep_mlp_num_layers': 8, 'deep_mlp_base_dim': 512, 'deep_mlp_dropout': 0.4962305649404234, 'deep_mlp_lr': 0.009254030612736922}. Best is trial 22 with value: 0.9749771944955573.[0m
Best trial: 22. Best value: 0.974977:  48%|█████████          | 48/100 [09:17<08:35,  9.91s/it]Best trial: 22. Best value: 0.974977:  48%|█████████          | 48/100 [09:17<08:35,  9.91s/it]Best trial: 22. Best value: 0.974977:  49%|█████████▎         | 49/100 [09:17<09:46, 11.50s/it]Variance threshold: 40004 → 40004 features
🔥 AMD ROCm GPU detected: AMD Radeon RX 7700 XT
🚀 Using GPU: cuda:0 - AMD Radeon RX 7700 XT (12.0GB ROCm)
                                                                                               [32m[I 2025-08-04 14:56:29,846][0m Trial 49 finished with value: 0.9333971864397563 and parameters: {'nn_model_type': 'resnet_custom', 'resnet_hidden_dim': 128, 'resnet_num_blocks': 4, 'resnet_dropout': 0.0986568437500201, 'resnet_lr': 0.002044518572651455}. Best is trial 22 with value: 0.9749771944955573.[0m
Best trial: 22. Best value: 0.974977:  49%|█████████▎         | 49/100 [09:27<09:46, 11.50s/it]Best trial: 22. Best value: 0.974977:  49%|█████████▎         | 49/100 [09:27<09:46, 11.50s/it]Best trial: 22. Best value: 0.974977:  50%|█████████▌         | 50/100 [09:27<09:07, 10.95s/it]Variance threshold: 40004 → 40004 features
🔥 AMD ROCm GPU detected: AMD Radeon RX 7700 XT
🚀 Using GPU: cuda:0 - AMD Radeon RX 7700 XT (12.0GB ROCm)
