All CLI output will be captured in: best_model_hold5/hold5_training_log.txt
[1m[96m🚀 Starting Auto Optuna Optimization - LOCAL DATA ONLY[0m
Dataset: D4B Temperature Dataset (VNA Measurements - S11/Phase/Xs Only)
Optimizer: neural_network
Target R²: 0.95
[1m[93m🔄 Loading: D4B Temperature Dataset (VNA Measurements - S11/Phase/Xs Only)[0m
[1m[93m🔄 Loading D4B VNA Temperature Dataset[0m
[96m📁 Loaded temp_readings-D4.csv: 3911 temperature readings[0m
[94m📁 Found 3915 VNA files in VNA-D4B/[0m
[94m📊 Temperature data: 3911 readings[0m
[92m✅ Dataset successfully loaded: 3915 VNA-temperature pairs[0m
[92m✅ Final dataset: X(3915, 40004), y(3915,)[0m
[96m📊 Temperature range: 8.50°C to 21.50°C[0m
[92m✅ Successfully loaded dataset: X(3915, 40004), y(3915,)[0m
[92m✅ Available NN libraries: torch[0m
🧠 NeuralNetworkOptimizer initialized for Hold-5
├── Max trials: 100
├── CV strategy: 5-fold × 3 repeats
└── Available NN libraries: 1
[1m[96m🧠 Starting Neural Network Optimization[0m
[1m[93m📊 Phase 1: Data Preparation[0m
Training set: X(3132, 40004), y(3132,)
Test set: X(391, 40004), y(391,)
Holdout set: X(392, 40004), y(392,)
[96m📊 Estimated noise ceiling: 0.9900[0m
   (Ridge baseline: 0.9437 ± 0.0168)
[1m[93m🔍 Phase 2: Neural Network Optimization[0m
  0%|                                                                  | 0/100 [00:00<?, ?it/s]Variance threshold: 40004 → 40004 features
🔥 AMD ROCm GPU detected: AMD Radeon RX 7700 XT
🚀 Using GPU: cuda:0 - AMD Radeon RX 7700 XT (12.0GB ROCm)
                                                                                               [32m[I 2025-08-04 14:47:17,550][0m Trial 0 finished with value: 0.4046357862614815 and parameters: {'nn_model_type': 'wide_deep', 'wd_deep_layers': 4, 'wd_deep_base_dim': 256, 'wd_wide_ratio': 0.7642251730311771, 'wd_lr': 1.023828188549658e-05}. Best is trial 0 with value: 0.4046357862614815.[0m
  0%|                                                                  | 0/100 [00:14<?, ?it/s]Best trial: 0. Best value: 0.404636:   0%|                             | 0/100 [00:14<?, ?it/s]Best trial: 0. Best value: 0.404636:   1%|▏                    | 1/100 [00:14<24:32, 14.87s/it]Variance threshold: 40004 → 40004 features
🔥 AMD ROCm GPU detected: AMD Radeon RX 7700 XT
🚀 Using GPU: cuda:0 - AMD Radeon RX 7700 XT (12.0GB ROCm)
                                                                                               [32m[I 2025-08-04 14:47:25,627][0m Trial 1 finished with value: -999.0 and parameters: {'nn_model_type': 'deepfm', 'deepfm_embedding_dim': 23, 'deepfm_num_layers': 5, 'deepfm_base_dim': 384, 'deepfm_dropout': 0.13670878205569514, 'deepfm_lr': 0.002463333549298161}. Best is trial 0 with value: 0.4046357862614815.[0m
Best trial: 0. Best value: 0.404636:   1%|▏                    | 1/100 [00:22<24:32, 14.87s/it]Best trial: 0. Best value: 0.404636:   1%|▏                    | 1/100 [00:22<24:32, 14.87s/it]Best trial: 0. Best value: 0.404636:   2%|▍                    | 2/100 [00:22<17:45, 10.87s/it]Variance threshold: 40004 → 40004 features
🔥 AMD ROCm GPU detected: AMD Radeon RX 7700 XT
🚀 Using GPU: cuda:0 - AMD Radeon RX 7700 XT (12.0GB ROCm)
                                                                                               [32m[I 2025-08-04 14:47:36,567][0m Trial 2 finished with value: -999.0 and parameters: {'nn_model_type': 'dcn', 'dcn_cross_layers': 3, 'dcn_deep_layers': 4, 'dcn_base_dim': 192, 'dcn_dropout': 0.02638323211006871, 'dcn_lr': 0.00021648022294411666}. Best is trial 0 with value: 0.4046357862614815.[0m
Best trial: 0. Best value: 0.404636:   2%|▍                    | 2/100 [00:33<17:45, 10.87s/it]Best trial: 0. Best value: 0.404636:   2%|▍                    | 2/100 [00:33<17:45, 10.87s/it]Best trial: 0. Best value: 0.404636:   3%|▋                    | 3/100 [00:33<17:37, 10.90s/it]Variance threshold: 40004 → 40004 features
🔥 AMD ROCm GPU detected: AMD Radeon RX 7700 XT
🚀 Using GPU: cuda:0 - AMD Radeon RX 7700 XT (12.0GB ROCm)
                                                                                               [32m[I 2025-08-04 14:47:46,830][0m Trial 3 finished with value: -999.0 and parameters: {'nn_model_type': 'simple_mlp', 'mlp_hidden_dim': 384, 'mlp_num_layers': 5, 'mlp_dropout': 0.28089867336099167, 'mlp_lr': 0.002913061973488582}. Best is trial 0 with value: 0.4046357862614815.[0m
Best trial: 0. Best value: 0.404636:   3%|▋                    | 3/100 [00:44<17:37, 10.90s/it]Best trial: 0. Best value: 0.404636:   3%|▋                    | 3/100 [00:44<17:37, 10.90s/it]Best trial: 0. Best value: 0.404636:   4%|▊                    | 4/100 [00:44<17:02, 10.65s/it]Variance threshold: 40004 → 40004 features
🔥 AMD ROCm GPU detected: AMD Radeon RX 7700 XT
🚀 Using GPU: cuda:0 - AMD Radeon RX 7700 XT (12.0GB ROCm)
                                                                                               [32m[I 2025-08-04 14:47:55,868][0m Trial 4 finished with value: -999.0 and parameters: {'nn_model_type': 'deep_mlp', 'deep_mlp_num_layers': 3, 'deep_mlp_base_dim': 128, 'deep_mlp_dropout': 0.49127123445091303, 'deep_mlp_lr': 0.008792491665036877}. Best is trial 0 with value: 0.4046357862614815.[0m
Best trial: 0. Best value: 0.404636:   4%|▊                    | 4/100 [00:53<17:02, 10.65s/it]Best trial: 0. Best value: 0.404636:   4%|▊                    | 4/100 [00:53<17:02, 10.65s/it]Best trial: 0. Best value: 0.404636:   5%|█                    | 5/100 [00:53<15:56, 10.07s/it]Variance threshold: 40004 → 40004 features
🔥 AMD ROCm GPU detected: AMD Radeon RX 7700 XT
🚀 Using GPU: cuda:0 - AMD Radeon RX 7700 XT (12.0GB ROCm)
                                                                                               [32m[I 2025-08-04 14:48:35,951][0m Trial 5 finished with value: -4.304009681594288 and parameters: {'nn_model_type': 'deep_mlp', 'deep_mlp_num_layers': 5, 'deep_mlp_base_dim': 384, 'deep_mlp_dropout': 0.3267724940655248, 'deep_mlp_lr': 0.0003054870204797935}. Best is trial 0 with value: 0.4046357862614815.[0m
Best trial: 0. Best value: 0.404636:   5%|█                    | 5/100 [01:33<15:56, 10.07s/it]Best trial: 0. Best value: 0.404636:   5%|█                    | 5/100 [01:33<15:56, 10.07s/it]Best trial: 0. Best value: 0.404636:   6%|█▎                   | 6/100 [01:33<31:45, 20.27s/it]Variance threshold: 40004 → 40004 features
🔥 AMD ROCm GPU detected: AMD Radeon RX 7700 XT
🚀 Using GPU: cuda:0 - AMD Radeon RX 7700 XT (12.0GB ROCm)
                                                                                               [32m[I 2025-08-04 14:48:48,601][0m Trial 6 finished with value: 0.9079030875744483 and parameters: {'nn_model_type': 'wide_deep', 'wd_deep_layers': 2, 'wd_deep_base_dim': 512, 'wd_wide_ratio': 0.4058646736418857, 'wd_lr': 0.0012458682727160006}. Best is trial 6 with value: 0.9079030875744483.[0m
Best trial: 0. Best value: 0.404636:   6%|█▎                   | 6/100 [01:45<31:45, 20.27s/it]Best trial: 6. Best value: 0.907903:   6%|█▎                   | 6/100 [01:45<31:45, 20.27s/it]Best trial: 6. Best value: 0.907903:   7%|█▍                   | 7/100 [01:45<27:33, 17.78s/it]Variance threshold: 40004 → 40004 features
🔥 AMD ROCm GPU detected: AMD Radeon RX 7700 XT
🚀 Using GPU: cuda:0 - AMD Radeon RX 7700 XT (12.0GB ROCm)
                                                                                               [32m[I 2025-08-04 14:48:57,968][0m Trial 7 finished with value: 0.9670344380916239 and parameters: {'nn_model_type': 'resnet_custom', 'resnet_hidden_dim': 64, 'resnet_num_blocks': 3, 'resnet_dropout': 0.026965995316913748, 'resnet_lr': 0.00212246102069481}. Best is trial 7 with value: 0.9670344380916239.[0m
Best trial: 6. Best value: 0.907903:   7%|█▍                   | 7/100 [01:55<27:33, 17.78s/it]Best trial: 7. Best value: 0.967034:   7%|█▍                   | 7/100 [01:55<27:33, 17.78s/it]Best trial: 7. Best value: 0.967034:   8%|█▋                   | 8/100 [01:55<23:09, 15.10s/it]Variance threshold: 40004 → 40004 features
🔥 AMD ROCm GPU detected: AMD Radeon RX 7700 XT
🚀 Using GPU: cuda:0 - AMD Radeon RX 7700 XT (12.0GB ROCm)
                                                                                               [32m[I 2025-08-04 14:49:10,706][0m Trial 8 finished with value: -999.0 and parameters: {'nn_model_type': 'deep_mlp', 'deep_mlp_num_layers': 4, 'deep_mlp_base_dim': 256, 'deep_mlp_dropout': 0.2997354798299465, 'deep_mlp_lr': 1.2883665353131986e-05}. Best is trial 7 with value: 0.9670344380916239.[0m
Best trial: 7. Best value: 0.967034:   8%|█▋                   | 8/100 [02:08<23:09, 15.10s/it]Best trial: 7. Best value: 0.967034:   8%|█▋                   | 8/100 [02:08<23:09, 15.10s/it]Best trial: 7. Best value: 0.967034:   9%|█▉                   | 9/100 [02:08<21:47, 14.36s/it]Variance threshold: 40004 → 40004 features
🔥 AMD ROCm GPU detected: AMD Radeon RX 7700 XT
🚀 Using GPU: cuda:0 - AMD Radeon RX 7700 XT (12.0GB ROCm)
                                                                                               [32m[I 2025-08-04 14:49:23,430][0m Trial 9 finished with value: -999.0 and parameters: {'nn_model_type': 'deep_mlp', 'deep_mlp_num_layers': 4, 'deep_mlp_base_dim': 256, 'deep_mlp_dropout': 0.10321135663765135, 'deep_mlp_lr': 0.0006993263873415354}. Best is trial 7 with value: 0.9670344380916239.[0m
Best trial: 7. Best value: 0.967034:   9%|█▉                   | 9/100 [02:20<21:47, 14.36s/it]Best trial: 7. Best value: 0.967034:   9%|█▉                   | 9/100 [02:20<21:47, 14.36s/it]Best trial: 7. Best value: 0.967034:  10%|██                  | 10/100 [02:20<20:47, 13.86s/it]Variance threshold: 40004 → 40004 features
🔥 AMD ROCm GPU detected: AMD Radeon RX 7700 XT
🚀 Using GPU: cuda:0 - AMD Radeon RX 7700 XT (12.0GB ROCm)
                                                                                               [32m[I 2025-08-04 14:49:32,967][0m Trial 10 finished with value: 0.9696474001524286 and parameters: {'nn_model_type': 'resnet_custom', 'resnet_hidden_dim': 64, 'resnet_num_blocks': 3, 'resnet_dropout': 0.00599706818640218, 'resnet_lr': 0.0035682471062803986}. Best is trial 10 with value: 0.9696474001524286.[0m
Best trial: 7. Best value: 0.967034:  10%|██                  | 10/100 [02:30<20:47, 13.86s/it]Best trial: 10. Best value: 0.969647:  10%|█▉                 | 10/100 [02:30<20:47, 13.86s/it]Best trial: 10. Best value: 0.969647:  11%|██                 | 11/100 [02:30<18:35, 12.54s/it]Variance threshold: 40004 → 40004 features
🔥 AMD ROCm GPU detected: AMD Radeon RX 7700 XT
🚀 Using GPU: cuda:0 - AMD Radeon RX 7700 XT (12.0GB ROCm)
                                                                                               [32m[I 2025-08-04 14:49:42,375][0m Trial 11 finished with value: 0.9611069376434213 and parameters: {'nn_model_type': 'resnet_custom', 'resnet_hidden_dim': 64, 'resnet_num_blocks': 3, 'resnet_dropout': 0.006842178811123591, 'resnet_lr': 0.003573705321932261}. Best is trial 10 with value: 0.9696474001524286.[0m
Best trial: 10. Best value: 0.969647:  11%|██                 | 11/100 [02:39<18:35, 12.54s/it]Best trial: 10. Best value: 0.969647:  11%|██                 | 11/100 [02:39<18:35, 12.54s/it]Best trial: 10. Best value: 0.969647:  12%|██▎                | 12/100 [02:39<16:59, 11.58s/it]Variance threshold: 40004 → 40004 features
🔥 AMD ROCm GPU detected: AMD Radeon RX 7700 XT
🚀 Using GPU: cuda:0 - AMD Radeon RX 7700 XT (12.0GB ROCm)
                                                                                               [32m[I 2025-08-04 14:49:51,791][0m Trial 12 finished with value: 0.6532555247058429 and parameters: {'nn_model_type': 'resnet_custom', 'resnet_hidden_dim': 64, 'resnet_num_blocks': 3, 'resnet_dropout': 0.011319888922823582, 'resnet_lr': 0.001953332562778116}. Best is trial 10 with value: 0.9696474001524286.[0m
Best trial: 10. Best value: 0.969647:  12%|██▎                | 12/100 [02:49<16:59, 11.58s/it]Best trial: 10. Best value: 0.969647:  12%|██▎                | 12/100 [02:49<16:59, 11.58s/it]Best trial: 10. Best value: 0.969647:  13%|██▍                | 13/100 [02:49<15:50, 10.93s/it]Variance threshold: 40004 → 40004 features
🔥 AMD ROCm GPU detected: AMD Radeon RX 7700 XT
🚀 Using GPU: cuda:0 - AMD Radeon RX 7700 XT (12.0GB ROCm)
                                                                                               [32m[I 2025-08-04 14:50:01,792][0m Trial 13 finished with value: 0.9446832896333403 and parameters: {'nn_model_type': 'resnet_custom', 'resnet_hidden_dim': 64, 'resnet_num_blocks': 6, 'resnet_dropout': 0.06842972154785687, 'resnet_lr': 0.00973957649590533}. Best is trial 10 with value: 0.9696474001524286.[0m
Best trial: 10. Best value: 0.969647:  13%|██▍                | 13/100 [02:59<15:50, 10.93s/it]Best trial: 10. Best value: 0.969647:  13%|██▍                | 13/100 [02:59<15:50, 10.93s/it]Best trial: 10. Best value: 0.969647:  14%|██▋                | 14/100 [02:59<15:15, 10.65s/it]Variance threshold: 40004 → 40004 features
🔥 AMD ROCm GPU detected: AMD Radeon RX 7700 XT
🚀 Using GPU: cuda:0 - AMD Radeon RX 7700 XT (12.0GB ROCm)
                                                                                               [32m[I 2025-08-04 14:50:15,779][0m Trial 14 finished with value: 0.1476304360881693 and parameters: {'nn_model_type': 'resnet_custom', 'resnet_hidden_dim': 320, 'resnet_num_blocks': 2, 'resnet_dropout': 0.24750013718347505, 'resnet_lr': 0.00010746645058439272}. Best is trial 10 with value: 0.9696474001524286.[0m
Best trial: 10. Best value: 0.969647:  14%|██▋                | 14/100 [03:13<15:15, 10.65s/it]Best trial: 10. Best value: 0.969647:  14%|██▋                | 14/100 [03:13<15:15, 10.65s/it]Best trial: 10. Best value: 0.969647:  15%|██▊                | 15/100 [03:13<16:30, 11.65s/it]Variance threshold: 40004 → 40004 features
🔥 AMD ROCm GPU detected: AMD Radeon RX 7700 XT
🚀 Using GPU: cuda:0 - AMD Radeon RX 7700 XT (12.0GB ROCm)
                                                                                               [32m[I 2025-08-04 14:50:34,981][0m Trial 15 finished with value: 0.9131978031143557 and parameters: {'nn_model_type': 'resnet_custom', 'resnet_hidden_dim': 512, 'resnet_num_blocks': 4, 'resnet_dropout': 0.11082631512244699, 'resnet_lr': 0.0005715597412638747}. Best is trial 10 with value: 0.9696474001524286.[0m
Best trial: 10. Best value: 0.969647:  15%|██▊                | 15/100 [03:32<16:30, 11.65s/it]Best trial: 10. Best value: 0.969647:  15%|██▊                | 15/100 [03:32<16:30, 11.65s/it]Best trial: 10. Best value: 0.969647:  16%|███                | 16/100 [03:32<19:29, 13.93s/it]Variance threshold: 40004 → 40004 features
🔥 AMD ROCm GPU detected: AMD Radeon RX 7700 XT
🚀 Using GPU: cuda:0 - AMD Radeon RX 7700 XT (12.0GB ROCm)
                                                                                               [32m[I 2025-08-04 14:50:53,846][0m Trial 16 finished with value: -999.0 and parameters: {'nn_model_type': 'dcn', 'dcn_cross_layers': 6, 'dcn_deep_layers': 2, 'dcn_base_dim': 512, 'dcn_dropout': 0.2976258741409712, 'dcn_lr': 0.007092837037854934}. Best is trial 10 with value: 0.9696474001524286.[0m
Best trial: 10. Best value: 0.969647:  16%|███                | 16/100 [03:51<19:29, 13.93s/it]Best trial: 10. Best value: 0.969647:  16%|███                | 16/100 [03:51<19:29, 13.93s/it]Best trial: 10. Best value: 0.969647:  17%|███▏               | 17/100 [03:51<21:19, 15.41s/it]Variance threshold: 40004 → 40004 features
🔥 AMD ROCm GPU detected: AMD Radeon RX 7700 XT
🚀 Using GPU: cuda:0 - AMD Radeon RX 7700 XT (12.0GB ROCm)
                                                                                               [32m[I 2025-08-04 14:51:00,308][0m Trial 17 finished with value: -999.0 and parameters: {'nn_model_type': 'deepfm', 'deepfm_embedding_dim': 64, 'deepfm_num_layers': 2, 'deepfm_base_dim': 128, 'deepfm_dropout': 0.26639513959458017, 'deepfm_lr': 1.1910329791558504e-05}. Best is trial 10 with value: 0.9696474001524286.[0m
Best trial: 10. Best value: 0.969647:  17%|███▏               | 17/100 [03:57<21:19, 15.41s/it]Best trial: 10. Best value: 0.969647:  17%|███▏               | 17/100 [03:57<21:19, 15.41s/it]Best trial: 10. Best value: 0.969647:  18%|███▍               | 18/100 [03:57<17:23, 12.72s/it]Variance threshold: 40004 → 40004 features
🔥 AMD ROCm GPU detected: AMD Radeon RX 7700 XT
🚀 Using GPU: cuda:0 - AMD Radeon RX 7700 XT (12.0GB ROCm)
                                                                                               [32m[I 2025-08-04 14:51:09,508][0m Trial 18 finished with value: 0.7110812481776589 and parameters: {'nn_model_type': 'simple_mlp', 'mlp_hidden_dim': 64, 'mlp_num_layers': 2, 'mlp_dropout': 0.0031337938485560546, 'mlp_lr': 1.0263744957505356e-05}. Best is trial 10 with value: 0.9696474001524286.[0m
Best trial: 10. Best value: 0.969647:  18%|███▍               | 18/100 [04:06<17:23, 12.72s/it]Best trial: 10. Best value: 0.969647:  18%|███▍               | 18/100 [04:06<17:23, 12.72s/it]Best trial: 10. Best value: 0.969647:  19%|███▌               | 19/100 [04:06<15:44, 11.66s/it]Variance threshold: 40004 → 40004 features
🔥 AMD ROCm GPU detected: AMD Radeon RX 7700 XT
🚀 Using GPU: cuda:0 - AMD Radeon RX 7700 XT (12.0GB ROCm)
                                                                                               [32m[I 2025-08-04 14:51:22,599][0m Trial 19 finished with value: 0.8015330435004407 and parameters: {'nn_model_type': 'resnet_custom', 'resnet_hidden_dim': 192, 'resnet_num_blocks': 8, 'resnet_dropout': 0.17247763738522556, 'resnet_lr': 0.0007652627296750118}. Best is trial 10 with value: 0.9696474001524286.[0m
Best trial: 10. Best value: 0.969647:  19%|███▌               | 19/100 [04:19<15:44, 11.66s/it]Best trial: 10. Best value: 0.969647:  19%|███▌               | 19/100 [04:19<15:44, 11.66s/it]Best trial: 10. Best value: 0.969647:  20%|███▊               | 20/100 [04:19<16:07, 12.09s/it]Variance threshold: 40004 → 40004 features
🔥 AMD ROCm GPU detected: AMD Radeon RX 7700 XT
🚀 Using GPU: cuda:0 - AMD Radeon RX 7700 XT (12.0GB ROCm)
                                                                                               [32m[I 2025-08-04 14:51:35,251][0m Trial 20 finished with value: 0.9185606153093481 and parameters: {'nn_model_type': 'resnet_custom', 'resnet_hidden_dim': 192, 'resnet_num_blocks': 5, 'resnet_dropout': 0.062164778978416144, 'resnet_lr': 0.009863843005300903}. Best is trial 10 with value: 0.9696474001524286.[0m
Best trial: 10. Best value: 0.969647:  20%|███▊               | 20/100 [04:32<16:07, 12.09s/it]Best trial: 10. Best value: 0.969647:  20%|███▊               | 20/100 [04:32<16:07, 12.09s/it]Best trial: 10. Best value: 0.969647:  21%|███▉               | 21/100 [04:32<16:08, 12.26s/it]Variance threshold: 40004 → 40004 features
🔥 AMD ROCm GPU detected: AMD Radeon RX 7700 XT
🚀 Using GPU: cuda:0 - AMD Radeon RX 7700 XT (12.0GB ROCm)
                                                                                               [32m[I 2025-08-04 14:51:44,717][0m Trial 21 finished with value: 0.9718657266619374 and parameters: {'nn_model_type': 'resnet_custom', 'resnet_hidden_dim': 64, 'resnet_num_blocks': 2, 'resnet_dropout': 0.007303810558299564, 'resnet_lr': 0.0025858636948696946}. Best is trial 21 with value: 0.9718657266619374.[0m
Best trial: 10. Best value: 0.969647:  21%|███▉               | 21/100 [04:42<16:08, 12.26s/it]Best trial: 21. Best value: 0.971866:  21%|███▉               | 21/100 [04:42<16:08, 12.26s/it]Best trial: 21. Best value: 0.971866:  22%|████▏              | 22/100 [04:42<14:50, 11.42s/it]Variance threshold: 40004 → 40004 features
🔥 AMD ROCm GPU detected: AMD Radeon RX 7700 XT
🚀 Using GPU: cuda:0 - AMD Radeon RX 7700 XT (12.0GB ROCm)
                                                                                               [32m[I 2025-08-04 14:51:55,095][0m Trial 22 finished with value: 0.9749771944955573 and parameters: {'nn_model_type': 'resnet_custom', 'resnet_hidden_dim': 128, 'resnet_num_blocks': 2, 'resnet_dropout': 0.010716112128622697, 'resnet_lr': 0.0018485701213890255}. Best is trial 22 with value: 0.9749771944955573.[0m
Best trial: 21. Best value: 0.971866:  22%|████▏              | 22/100 [04:52<14:50, 11.42s/it]Best trial: 22. Best value: 0.974977:  22%|████▏              | 22/100 [04:52<14:50, 11.42s/it]Best trial: 22. Best value: 0.974977:  23%|████▎              | 23/100 [04:52<14:15, 11.11s/it]Variance threshold: 40004 → 40004 features
🔥 AMD ROCm GPU detected: AMD Radeon RX 7700 XT
🚀 Using GPU: cuda:0 - AMD Radeon RX 7700 XT (12.0GB ROCm)
                                                                                               [32m[I 2025-08-04 14:52:07,098][0m Trial 23 finished with value: 0.9682429869319327 and parameters: {'nn_model_type': 'resnet_custom', 'resnet_hidden_dim': 192, 'resnet_num_blocks': 2, 'resnet_dropout': 0.00133124432902979, 'resnet_lr': 0.002509188888535606}. Best is trial 22 with value: 0.9749771944955573.[0m
Best trial: 22. Best value: 0.974977:  23%|████▎              | 23/100 [05:04<14:15, 11.11s/it]Best trial: 22. Best value: 0.974977:  23%|████▎              | 23/100 [05:04<14:15, 11.11s/it]Best trial: 22. Best value: 0.974977:  24%|████▌              | 24/100 [05:04<14:24, 11.38s/it]Variance threshold: 40004 → 40004 features
🔥 AMD ROCm GPU detected: AMD Radeon RX 7700 XT
🚀 Using GPU: cuda:0 - AMD Radeon RX 7700 XT (12.0GB ROCm)
